id,title,release_date,genres,video_key,overview,trailer_url,keywords,popularity,vote_count,vote_average
77117,Sunny,2011-05-04,['Drama'],lqqaK_0rHnQ,"Na-mi, a transfer student, becomes a laughingstock on her first day of school because of her strong southern dialect. Six girls jump in to help the new kid adapt to the new environment, and the girls come to call their circle of friends ""Sunny.""",https://www.youtube.com/watch?v=lqqaK_0rHnQ,"['bullying', 'gang', 'experimental']",8.04,101,7.9
88557,Pokémon the Movie White: Victini and Zekrom,2011-07-16,"['Adventure', 'Animation', 'Family', 'Drama', 'Fantasy']",,"The Kingdom of the People of the Earth once ruled over the land, but now all that remains is the Sword of the Earth. in the city of Eindoak. Satoshi, Iris, and Dent arrive in Eindoak during a harvest festival's Pokémon Tournament and meet the legendary Pokémon Victini who wishes to share its powers of victory to someone. Elsewhere in the city, a descendant of the People of the Earth named Dred Grangil has arrived who seeks to revive the kingdom's power with the Sword of the Earth, bringing them back into power over the land, and Satoshi and his friends must stop him before he destroys the land along with Victini.",,"['pokémon', 'anime']",19.273,100,6.5
86820,4:44 Last Day on Earth,2011-09-07,"['Drama', 'Science Fiction']",5O7Moj-egTw,A look at how a painter and a successful actor spend their last day together before the world comes to an end.,https://www.youtube.com/watch?v=5O7Moj-egTw,"['artist', 'end of the world', 'apocalypse', 'apartment', 'actor']",9.234,100,4.8
56272,Elektra Luxx,2011-03-11,"['Comedy', 'Drama']",3rYphjNUkkk,"A favor for a woman from her past throws the life of a pregnant, retired porn star into chaos.",https://www.youtube.com/watch?v=3rYphjNUkkk,"['trapped in an elevator', 'book signing', 'going into labor', 'talking in sleep', 'oblivious to woman who loves him', 'friends in love', 'annoying little sister', 'lisp', 'wet dream']",9.726,100,4.8
85836,Hara-Kiri: Death of a Samurai,2011-10-15,['Drama'],R-sp6Xw0jJU,"A tale of revenge, honor and disgrace, centering on a poverty-stricken samurai who discovers the fate of his ronin son-in-law, setting in motion a tense showdown of vengeance against the house of a feudal lord.",https://www.youtube.com/watch?v=R-sp6Xw0jJU,"['japan', 'asia', 'samurai', 'honor', 'poverty', 'seppuku', 'code of honor', 'ronin', 'shogun', 'bushido', 'daimos', 'feudal lord', 'feudal japan', 'harakiri', 'daimyô', 'hara-kiri']",7.686,99,7.2
81870,Flying Swords of Dragon Gate,2011-12-15,"['Adventure', 'Action']",veI3veD-JrE,"Flying Swords of Dragon Gate picks up three years after the infamous Dragon Inn was burnt down in the desert when its innkeeper Jade vanished. A new gang of marauders had taken over - innkeepers by day and treasure hunters by night. The inn is the rumoured location of a lost city buried under the desert, and its hidden treasure would only be revealed by a gigantic storm every 60 years. The gang used the inn as a front to locate the lost treasure.",https://www.youtube.com/watch?v=veI3veD-JrE,"['martial arts', 'sandstorm', 'eunuch', 'concubine', 'chinese emperor', 'wuxia', '15th century']",12.635,99,6
124277,The Maker,2011-06-23,['Animation'],,A strange creature races against time to make the most important and beautiful creation of his life.,,['short'],4.08,98,7.6
72560,Federal Bank Heist,2011-07-22,"['Crime', 'Drama', 'Thriller']",,"""The Baron"" wanted to commit the perfect heist involving 3 tons of money and no violence. For this he would need the right people willing to get 1 million dollars to take part in this job. Based on true events, in 2005, 168,000,000 Brazilian Real (almost 80,000,000 US dollars) were stolen from a Brazilian Central Bank (Federal Reserve), making it the biggest peace-time robbery in history. It was perhaps the most audacious bank heist ever.",,[],5.038,98,6.2
51017,Madea's Big Happy Family,2011-04-22,"['Comedy', 'Drama']",bExi5_p28Mo,"Shirley has important news for her family, but she has five grown children with different lifestyles and finds it difficult to get them and the kids all together. So in steps Madea, the Matriarch General, to put the family's life in perspective with a hilarious twist on financial difficulties, drugs and, most important, family secrets. The next generation has a lot to learn. In her own way, Madea expresses how deliverance won't change you to be someone else, but will allow you to be who you really are.",https://www.youtube.com/watch?v=bExi5_p28Mo,"['mother role', 'big family', 'family clan', 'duringcreditsstinger']",9.734,98,6.9
75229,The Monitor,2011-10-07,"['Drama', 'Thriller']",,"Oslo, Norway. After living a traumatic experience, Anna and her son Anders move into a huge apartment building. Feeling constantly terrified and insecure, Anna buys a babycall to monitor Anders while he sleeps.",,"['social services', 'oslo, norway', 'baby monitor', 'overprotective mother', 'mother son relationship', 'traumatized woman']",5.199,97,5.5
62796,William & Kate,2011-04-18,"['Drama', 'Romance', 'TV Movie']",,"William &amp; Kate is the first of two unrelated American television films about the relationship between Prince William and Catherine ""Kate"" Middleton (now The Duke and Duchess of Cambridge), directed by Mark Rosman and written by Nancey Silvers. The film was a ratings success, despite the negative reception from critics. The second film William &amp; Catherine: A Royal Romance was produced by a different company and released in August 2011.",,"['royal family', 'love', 'royalty', 'royal court', 'united kingdom', 'young love', 'young couple']",5.742,97,5.7
61672,Titeuf,2011-04-06,['Animation'],,"Titeuf is a comic series created by Swiss draughtsman Zep (real name Philippe Chapuis) depicting the life of a young boy (the title's namesake Titeuf, ""Tootuff"" in the English translation) and his vision of the adult world & themes such as love, sex, seduction and mysteries about the girls.  In this film, Titeuf (Donald Reignoux) is off on a new comedic adventure! Things get complicated when Nadia (Melanie Bernier) doesn’t invite Titeuf to her birthday party, which is surely the most horrible moment of his life. Before long, Titeuf’s whole life is turned upside down when his parents are nearly deported. Everything continues to spiral out of control even in the midst of Titeuf’s exhaustive attempts to make matters right.",,[],6.672,97,5.6
85621,Men in Hope,2011-08-25,"['Comedy', 'Romance']",,"Charming bon vivant Rudolf is convinced that infidelity is the basis for a happy marriage, since, after all, a woman does not want to be bored with her partner.",,[],11.525,96,7.4
63579,Project Nim,2011-07-08,['Documentary'],yxQap9AAPOs,"From the team behind Man on Wire comes the story of Nim, the chimpanzee who in the 1970s became the focus of a landmark experiment which aimed to show that an ape could learn to communicate with language if raised and nurtured like a human child. Following Nim's extraordinary journey through human society, and the enduring impact he makes on the people he meets along the way, the film is an unflinching and unsentimental biography of an animal we tried to make human. What we learn about his true nature - and indeed our own - is comic, revealing and profoundly unsettling.",https://www.youtube.com/watch?v=yxQap9AAPOs,"['love of animals', 'wild animal', 'chimpanzee', 'linguistics']",7.584,96,6.9
98162,The Painting,2011-11-23,"['Fantasy', 'Animation']",G5NNf1lrj2c,Three characters living in an unfinished painting venture out into the real world in search of their creator to convince him to finish his work.,https://www.youtube.com/watch?v=G5NNf1lrj2c,"['france', 'painter', 'painting', 'worlds collide', 'class struggle', 'french animation']",4.508,95,7.3
91186,A Simple Life,2011-09-04,['Drama'],LGerZCQwvjE,"The relationship between a middle-aged man (Andy Lau) and the elderly woman (Deanie Ip), who has been the family's helper for sixty years.",https://www.youtube.com/watch?v=LGerZCQwvjE,"['maid', 'nursing home', 'stroke', 'woman director']",5.548,94,7.4
76115,The Phantom of the Opera at the Royal Albert Hall,2011-09-27,"['Music', 'Drama', 'Romance']",b88070kuP4w,"A disfigured musical genius, hidden away in the Paris Opera House, terrorises the opera company for the unwitting benefit of a young protégée whom he trains and loves. The 25th anniversary of the first public performance of Phantom of the Opera was celebrated with a grand performance at the Royal Albert Hall in London.",https://www.youtube.com/watch?v=b88070kuP4w,"['musical', 'concert musical']",13.782,94,8.4
62441,United,2011-01-02,"['Drama', 'History']",myNAceLxHI4,"United is based on the true story of Manchester United's legendary ""Busby Babes"", the youngest side ever to win the Football League and the 1958 Munich Air Crash that claimed eight of the their number. The film draws on first-hand interviews with the survivors and their families to tell the inspirational story of a team and community overcoming terrible tragedy.",https://www.youtube.com/watch?v=myNAceLxHI4,"['airplane crash', 'football (soccer)', 'manchester united', 'historical event', 'sports documentary']",11.025,94,7.1
61940,Some Say No,2011-01-01,['Comedy'],,"Some Say No is a new Italian comedy with a very serious subject: the way the country's society is corroded by favoritism that pushes inferior people to the top in virtually every field. In Florence, three thirty-somethings band together to wage their own war on the system. Each of them is a person of talent who has been pushed out by ""favorites"" or raccomandati, people who have muscled in on the promotions they ought to have gotten by pulling strings.",,[],4.329,94,5.7
82327,Goodbye First Love,2011-07-04,"['Drama', 'Romance']",7ZAH7bvJNRA,"A 15-year-old discovers the joys and heartaches of first love with an older teen, but in the ensuing years, cannot seem to move past their breakup.",https://www.youtube.com/watch?v=7ZAH7bvJNRA,"['paris, france', 'beach', 'letter', 'strike', 'architecture', 'teenage love', 'woman director', 'teenage romance', 'loire river and valley']",7.788,93,6.2
79723,New Kids Nitro,2011-12-07,"['Action', 'Comedy']",,"Gerrie, Richard, Rikkert, Robbie and Barry from Maaskantje are in a big fight with the village of Schijndel. When a zombie kills someone from Brabant, things get out of hand.",,['zombie'],9.538,93,5.9
79000,Tales of the Night,2011-07-20,"['Fantasy', 'Animation']",,"Tales of the Night is renowned animation auteur Michel Ocelot (Kirikou and the Sorceress, Azur & Asmar)'s first foray into 3D animation. A hit at the Berlin Film Festival, the film extends the earlier shadow puppet style of Ocelot’s Princes and Princesses, with black silhouetted characters set off against exquisitely detailed Day-Glo backgrounds bursting with color and kaleidoscopic patterns – the subtle use of 3D creating a diorama-like effect.  The film weaves together six exotic fables each unfolding in a unique locale, from Tibet, to medieval Europe, an Aztec kingdom, the African plains, and even the Land of the Dead. In Ocelot’s storytelling, history blends with fairytale as viewers are whisked off to enchanted lands full of dragons, werewolves, captive princesses, sorcerers, and enormous talking bees - and each fable ends with its own ironic twist.",,"['monster', 'sacrifice', 'love', 'honor', 'justice', 'deceit', 'french animation']",5.028,93,7.3
83660,Paradise Lost 3: Purgatory,2011-10-10,['Documentary'],B43Cj-JEJdo,A further investigation into the arrest of three teenagers convicted of killing three young boys in Arkansas who spent nearly 20 years in prison before being released after new DNA evidence indicated they may be innocent.,https://www.youtube.com/watch?v=B43Cj-JEJdo,[],11.746,92,7.5
76013,No Rest for the Wicked,2011-09-21,['Thriller'],EB7uBJfHyIs,"Madrid, the beginning of the century. One day, the police inspector Santos Trinidad coming home very drunk, is involved in a triple murder. But there is a witness who managed to escape and that could incriminate him. Santos undertakes an investigation to locate and eliminate the witness. Meanwhile, Chacón a judge in charge of investigating the triple murder, meticulously advances in the search for the murderer. Santos and Chacon soon discover that what seemed a simple case of drug trafficking is actually something far more dangerous.",https://www.youtube.com/watch?v=EB7uBJfHyIs,"['madrid, spain', 'investigation', 'witness to murder']",5.02,91,5.8
79221,Letters to Santa,2011-11-11,"['Comedy', 'Romance']",03eXimfuPfQ,A romantic comedy set on Christmas Eve in Warsaw and centered around a series of characters.,https://www.youtube.com/watch?v=03eXimfuPfQ,[],6.107,91,7.1
76349,1911,2011-07-03,"['Adventure', 'Drama', 'Action', 'History', 'War']",F1QKQ6N8qrs,"At the beginning of the 20th century, China is in a state of crisis. The country is split into warring factions, the citizens are starving, and recent political reforms have made matters worse, not better. The ruling Qing Dynasty, led by a seven-year-old emperor, and his ruthless mother, Empress Dowager Longyu is completely out of touch after 250 years of unquestioned power. Huang Xing has recently returned from Japan, where he has studied the art of modern warfare. When he finds his country falling apart, he feels he has no choice but to pick up the sword.",https://www.youtube.com/watch?v=F1QKQ6N8qrs,"['martial arts', 'sword', 'revolution', 'blood', 'gunfight', 'brutality', 'combat']",8.567,91,5.6
70587,Spooky Buddies,2011-09-20,"['Comedy', 'Family']",h-QkA7w_X7A,Disney's irresistible talking puppies are back in an all-new movie that takes them far across town to a mysterious mansion where something very spooky is going on.,https://www.youtube.com/watch?v=h-QkA7w_X7A,"['dog', 'buddies']",12.511,91,6.1
60089,Best Player,2011-03-12,"['Comedy', 'Family']",UJSyZ_cdzwg,"Chris Sanders and Quincy are both involved in a video game called ""Black Hole"", and they both want to win the tournament with a $175,500 prize. Quincy then tries to sabotage Chris, but it all goes wrong, because Chris' mom Tracy thinks that Quincy is her Internet date. Quincy lies to Tracy on their first date saying that he is a Home Ec. teacher at Chris' school. Right before the tournament, Chris figures out that Quincy was lying about everything. So, Chris decides that she will ""destroy"" him at the tournament. Quincy ends up forfeiting the tournament to show that he is sincerely sorry. Tracy takes him back, and they go to Chris' prom. Chris decides to go with her love interest in the movie, Ash.",https://www.youtube.com/watch?v=UJSyZ_cdzwg,"['video game', 'tournament']",8.617,91,5.9
79382,I Wish,2011-06-11,['Drama'],M63wEJBzupE,"Twelve-year-old Koichi, who has been separated from his brother Ryunosuke due to his parents' divorce, hears a rumor that the new bullet trains will precipitate a wish-granting miracle when they pass each other at top speed.",https://www.youtube.com/watch?v=M63wEJBzupE,"['sibling relationship', 'brother', 'train', 'broken family', 'brother brother relationship']",8.369,90,7.3
51993,Terri,2011-07-01,"['Comedy', 'Drama']",WVBbXHuD1C0,"Terri, a pajama-clad, disaffected high school student learns how to engage the world with the help of Mr. Fitzgerald, his assistant principal.",https://www.youtube.com/watch?v=WVBbXHuD1C0,"['overweight child', 'underage drinking', 'urination', 'high school friends', 'pijamas']",8.185,90,6.2
46541,Game of Death,2011-02-15,"['Adventure', 'Action', 'Thriller']",973jeNA7SFc,"CIA agent Marcus is sent undercover to Detroit to take out an arms dealer and the head of the hedge fund that is financing him. His CIA backup has other plans and turns on him, and it's a fight to survive in a hospital and into the hedge fund vault.",https://www.youtube.com/watch?v=973jeNA7SFc,"['cia', 'bodyguard']",8.937,90,5.1
145316,Air Mater,2011-08-04,"['Animation', 'Family']",,Mater's decision to fly lands him accidentally at a big airshow.,,"['flying', 'car', 'talking car', 'air show', 'short']",7.7,89,5.9
115223,Pokémon the Movie Black: Victini and Reshiram,2011-07-16,"['Animation', 'Family', 'Adventure', 'Drama', 'Fantasy']",,"The Kingdom of the People of the Earth once ruled over the land, but now all that remains is the Sword of the Earth. in the city of Eindoak. Satoshi, Iris, and Dent arrive in Eindoak during a harvest festival's Pokémon Tournament and meet the legendary Pokémon Victini who wishes to share its powers of victory to someone. Elsewhere in the city, a descendant of the People of the Earth named Dred Grangil has arrived who seeks to revive the kingdom's power with the Sword of the Earth, bringing them back into power over the land, and Satoshi and his friends must stop him before he destroys the land along with Victini.",,"['pokémon', 'anime']",17.947,89,6.4
95448,The Minister,2011-10-26,['Drama'],1vqbPSle7yw,Transport Minister Bertrand Saint-Jean is awoken in the middle of the night by his head of staff. A bus has gone off the road into a gully. He has no choice but to go to the scene of the accident. Thus begins the odyssey of a politician in a world that is increasingly more complex and hostile.,https://www.youtube.com/watch?v=1vqbPSle7yw,[],4.144,89,6.4
81684,The Gruffalo's Child,2011-12-25,"['Adventure', 'Animation', 'Family', 'Fantasy']",mgT2N2VkG5o,"A follow up to the 2009 animated feature and adapted from the childrens' book by Julia Donaldson and Alex Scheffler.  The Gruffalo's child explores the deep dark wood in search of the big bad mouse and meets the Snake, Owl and Fox in the process.  She eventually finds the mouse, who manages to outwit her like the Gruffalo before!",https://www.youtube.com/watch?v=mgT2N2VkG5o,"['mouse', 'search', ""based on children's book"", 'imaginary creature', 'short']",8.536,89,6.8
66122,Low Cost,2011-06-08,['Comedy'],,"Passengers on a low cost flight from Djerba to Beauvais have their patience tested to destruction when their departure is delayed for eight hours because of a fault with the plane's air-conditioning. In the end, they are so fed up that they will do almost anything to get back home.",,[],4.388,89,5.1
106231,Un natale x 2,2011-12-25,['Comedy'],,,,[],5.6,88,5.5
82529,Combat Girls,2011-06-28,['Drama'],fSQVf1KQxDA,"Marisa, a 20-year-old German girl, hates foreigners, Jews, cops, and everyone she finds guilty for the decline of her country. She provokes, drinks, fights and her next tattoo will be a portrait of Adolf Hitler. The only place she feels home is the Neo-Nazi gang she belongs to, where hate, violence, and heavy parties are the daily rules. When 14-year-old Svenja joins the group, Marisa appears like a role model to her: she fits the purest idea of a combat girl fighting for the group's ideology. But Marisa's convictions will slowly evolve when she accidentally meets a young Afghan refugee. Confronted to him, she will learn that the black and white principles of her gang are not the only way. Will Marisa ever be able to get out of this group?",https://www.youtube.com/watch?v=fSQVf1KQxDA,"['neo nazism', 'refugee', 'ideology', 'racism', 'combat', 'hate']",6.453,88,6.9
79374,Blind,2011-08-10,['Thriller'],NPrVJzFSucA,A blind witness and a runaway help the police find the suspect in a Hit and Run until the culprit realizes that they are close on his trail. The killer tracks her down and Soo-ah realizes that in order to save Gi-sub she would have to risk her life.,https://www.youtube.com/watch?v=NPrVJzFSucA,[],4.323,88,7.5
79070,Sleepless Night,2011-11-16,"['Drama', 'Thriller']",S1iQSYKZxFw,"Vincent, a police officer, and his partner Manuel steal a large amount of cocaine from José Marciano, a ruthless crime lord who is quick to seek revenge, endangering Vincent's life, career and family.",https://www.youtube.com/watch?v=S1iQSYKZxFw,"['night life', 'nightclub', 'one-night stand', 'internal affairs', 'co-worker relationship', 'drug lord', 'ex-husband ex-wife relationship', 'nightclub owner', 'crooked cop', 'heist gone wrong', 'father son relationship']",4.853,88,6
73582,Bodyguard,2011-08-31,"['Drama', 'Action', 'Romance']",,"Lovely Singh is extremely respectful of Mr Rana and his daughter Divya. While appointed as Divya's bodyguard, he falls in love with a girl he has never met, unaware that she is none other than Divya.",,"['lie', 'diary', 'college', 'remake', 'train', 'railroad']",8.503,88,5.2
164052,The Strange Thing About the Johnsons,2011-01-22,"['Drama', 'Comedy']",cAJb0S5xylg,A dark domestic melodrama/satire about the ties that bind and the ties that really bind.,https://www.youtube.com/watch?v=cAJb0S5xylg,"['secret', 'poet', 'satire', 'family relationships', 'domestic violence', 'family drama', 'wedding', 'family', 'male masturbation', 'incest', 'dark secret', 'abuse', 'strange', 'dark romance', 'domestic strife', 'abusive person', 'short']",6.655,87,6.6
79836,Il giorno in più,2011-12-02,"['Comedy', 'Romance']",,,,[],5.088,87,6
78192,Michael Jackson: The Life of an Icon,2011-06-06,['Documentary'],,"See Michael Jackson, one of the most recognizable and popular entertainers of all time, like never before in the feature-length tribute Michael Jackson: The Life of an Icon. Known to millions of fans worldwide for his record-breaking albums, groundbreaking music videos, mesmerizing dance moves and humanitarian efforts, his true story has never really been told...until now. This unprecedented look into the King of Pop's fascinating life includes all-new interviews with his mother Katherine Jackson as well as siblings Tito and Rebbie Jackson, family, friends and music legends such as Smokey Robinson, Dionne Warwick and many more.",,[],28.864,87,7.7
78080,Beethoven's Christmas Adventure,2011-11-08,"['Comedy', 'Family']",P5XCrK5nmrY,"A Christmas elf accidentally takes off in Santa's sleigh, crash lands in a small town, and loses the magic toy bag. Beethoven must rescue the elf, recover the bag from greedy crooks, and return the sleigh to Santa in time to save Christmas.",https://www.youtube.com/watch?v=P5XCrK5nmrY,"['holiday', 'christmas']",8.013,87,6.1
67900,Scooby-Doo! Legend of the Phantosaur,2011-09-06,"['Mystery', 'Animation', 'Family', 'Comedy']",pm_4-uBaskU,"A relaxing spa getaway evolves into a prehistoric panic when Scooby-Doo and the gang uncover the horrible Phantosaur, an ancient legend come to life to protect hidden treasures buried in secret desert caves. But this scare-a-saurus doesn’t stand a chance with Shaggy around, after he finds his inner hero with the help of new-age hypnosis. Like, it makes him more brave and less hungry!",https://www.youtube.com/watch?v=pm_4-uBaskU,[],25.58,87,7.1
93394,Elevator,2011-01-01,['Thriller'],51KF3ZX76KM,Nine people are stuck in an elevator. One of them has a ticking bomb that can't be defused. The other eight will do anything to survive. There is no escape and no promise of rescue. As the tension in the elevator mounts the unthinkable soon becomes the only reasonable solution.,https://www.youtube.com/watch?v=51KF3ZX76KM,"['greed', 'tension', 'racism', 'stranger', 'trapped in an elevator']",7.557,86,5
85431,Take Me Home,2011-03-02,"['Comedy', 'Romance']",F5K-Dl4DUV4,"Soon after Thom starts operating as an illegal taxi driver in New York City, Claire hires him to drive her to California after her estranged father suffers a heart attack.",https://www.youtube.com/watch?v=F5K-Dl4DUV4,[],8.369,86,6.5
77460,Beur sur la ville,2011-10-11,['Comedy'],,"25-year-old Khalid Belkacem has failed at everything: college education, summer camp instructor's permit, driver's license, and even his BCG. He never expected to become the first ""positive discrimination"" member of the police force. But as his mother says: ""That's France for you! A country where everyone has a chance.""",,[],4.01,86,4.4
73939,Pariah,2011-12-27,['Drama'],pNRdxsTmV1U,"A Brooklyn teenager juggles conflicting identities and risks friendship, heartbreak, and family in a desperate search for sexual expression.",https://www.youtube.com/watch?v=pNRdxsTmV1U,"['identity', 'female homosexuality', 'dyje', 'teenage sexuality', 'lgbt teen', 'woman director', 'black lgbt']",9.29,86,7
73770,What a Man,2011-08-25,"['Comedy', 'Romance']",TdXytJSRrtA,"What a man is a comedy that tells the story of a young professor, Alex (Matthias Schweighofer), which after being left by his girlfriend Caroline (Mavie Hörbiger), begins a journey to know himself. But how do you overcome the difficulties of a man today? Or rather what is it that makes a man a man?",https://www.youtube.com/watch?v=TdXytJSRrtA,[],5.81,86,5.4
70608,LEGO Star Wars: The Padawan Menace,2011-07-22,"['Animation', 'Family', 'Science Fiction']",3A68Ka8hiiI,"Master Yoda must go retrieve secret battle plans. However, when a class of younglings join the mission - things become a little more complicated.",https://www.youtube.com/watch?v=3A68Ka8hiiI,"['space opera', 'lego']",11.229,86,6.4
