id,title,release_date,genres,video_key,overview,trailer_url,keywords,popularity,vote_count,vote_average
1771,Captain America: The First Avenger,2011-07-22,"['Action', 'Adventure', 'Science Fiction']",W4DlMggBPvc,"During World War II, Steve Rogers is a sickly man from Brooklyn who's transformed into super-soldier Captain America to aid in the war effort. Rogers must stop the Red Skull – Adolf Hitler's ruthless head of weaponry, and the leader of an organization that intends to use a mysterious device of untold powers for world domination.",https://www.youtube.com/watch?v=W4DlMggBPvc,"['new york city', 'world war ii', 'nazi', 'superhero', 'based on comic', 'heroism', 'period drama', 'brooklyn, new york city', 'aftercreditsstinger', 'marvel cinematic universe']",59.754,16167,6.9
10195,Thor,2011-04-21,"['Adventure', 'Fantasy', 'Action']",uHBnrJowBZE,"Against his father Odin's will, The Mighty Thor - a powerful but arrogant warrior god - recklessly reignites an ancient war. Thor is cast down to Earth and forced to live among humans as punishment. Once here, Thor learns what it takes to be a true hero when the most dangerous villain of his world sends the darkest forces of Asgard to invade Earth.",https://www.youtube.com/watch?v=uHBnrJowBZE,"['new mexico', 'banishment', 'superhero', 'based on comic', 'redemption', 'norse mythology', 'aftercreditsstinger', 'marvel cinematic universe']",67.411,15980,6.8
12445,Harry Potter and the Deathly Hallows: Part 2,2011-07-07,"['Fantasy', 'Adventure']",5NYt1qirBWg,"Harry, Ron and Hermione continue their quest to vanquish the evil Voldemort once and for all. Just as things begin to look hopeless for the young wizards, Harry discovers a trio of magical objects that endow him with powers to rival Voldemort's formidable skills.",https://www.youtube.com/watch?v=5NYt1qirBWg,"['self sacrifice', 'magic', 'sorcerer', 'school', 'wizard', 'based on young adult novel']",111.256,15175,8.1
77338,The Intouchables,2011-11-02,"['Drama', 'Comedy']",34WIbmXkewU,A true story of two men who should never have met – a quadriplegic aristocrat who was injured in a paragliding accident and a young man from the projects.,https://www.youtube.com/watch?v=34WIbmXkewU,"['male friendship', 'masseuse', 'friendship', 'based on a true story', 'aristocrat', 'paragliding', 'interracial friendship', 'unlikely friendship', 'duringcreditsstinger', 'quadriplegic', 'quadriplegia']",83.942,12933,8.2
1865,Pirates of the Caribbean: On Stranger Tides,2011-05-14,"['Adventure', 'Action', 'Fantasy']",t5AqJww06bw,"Captain Jack Sparrow crosses paths with a woman from his past, and he's not sure if it's love -- or if she's a ruthless con artist who's using him to find the fabled Fountain of Youth. When she forces him aboard the Queen Anne's Revenge, the ship of the formidable pirate Blackbeard, Jack finds himself on an unexpected adventure in which he doesn't know who to fear more: Blackbeard or the woman from his past.",https://www.youtube.com/watch?v=t5AqJww06bw,"['england', 'spain', 'sea', 'captain', 'mutiny', 'sword', 'prime minister', 'sailing', 'silver', 'ship', 'duke', 'mermaid', 'pirate', 'soldier', 'battle', 'swashbuckler', '18th century', 'aftercreditsstinger', 'blackbeard', '1750s']",71.481,10615,6.5
49538,X-Men: First Class,2011-06-01,"['Action', 'Science Fiction', 'Adventure']",kyQKi5-k0UU,"Before Charles Xavier and Erik Lensherr took the names Professor X and Magneto, they were two young men discovering their powers for the first time. Before they were arch-enemies, they were closest of friends, working together with other mutants (some familiar, some new), to stop the greatest threat the world has ever known.",https://www.youtube.com/watch?v=kyQKi5-k0UU,"['cia', 'nuclear war', 'mutant', 'mine', 'superhero', 'based on comic', 'thriller', 'superhuman', 'historical fiction', 'cuban missile crisis', 'world war iii', '1960s', 'x-men']",2.063,9917,7.3
64690,Drive,2011-06-17,"['Drama', 'Thriller', 'Crime']",0eup3tFOgbk,"Driver is a skilled Hollywood stuntman who moonlights as a getaway driver for criminals. Though he projects an icy exterior, lately he's been warming up to a pretty neighbor named Irene and her young son, Benicio. When Irene's husband gets out of jail, he enlists Driver's help in a million-dollar heist. The job goes horribly wrong, and Driver must risk his life to protect Irene and Benicio from the vengeful masterminds behind the robbery.",https://www.youtube.com/watch?v=0eup3tFOgbk,"['car mechanic', 'stuntman', 'revenge', 'neighbor', 'police chase', 'beaten to death', 'los angeles, california', 'brutality', 'violence', 'car chase', 'getaway driver', 'crime lord', 'existentialism', 'neo-noir', 'silent protagonist']",24.742,9008,7.6
61791,Rise of the Planet of the Apes,2011-08-03,"['Thriller', 'Action', 'Drama', 'Science Fiction']",P1yKN0llkrY,"Scientist Will Rodman is determined to find a cure for Alzheimer's, the disease which has slowly consumed his father. Will feels certain he is close to a breakthrough and tests his latest serum on apes, noticing dramatic increases in intelligence and brain activity in the primate subjects – especially Caesar, his pet chimpanzee.",https://www.youtube.com/watch?v=P1yKN0llkrY,"['intelligence', 'zoo', 'cage', 'dystopia', ""alzheimer's disease"", 'golden gate bridge', 'ape', 'monkey', 'medical research']",69.409,8950,7.3
49530,In Time,2011-10-27,"['Action', 'Thriller', 'Science Fiction']",xhYUaR5QiUs,"In the not-too-distant future the aging gene has been switched off. To avoid overpopulation, time has become the currency and the way people pay for luxuries and necessities. The rich can live forever, while the rest try to negotiate for their immortality. A poor young man who comes into a fortune of time, though too late to help his mother from dying. He ends up on the run from a corrupt police force known as 'time keepers'.",https://www.youtube.com/watch?v=xhYUaR5QiUs,"['bank', 'future', 'time', 'dystopia', 'race against time', 'immortality', 'love', 'thriller', 'on the run', 'class differences', 'cops and robbers\xa0', 'rich vs poor']",51.558,8297,6.9
58574,Sherlock Holmes: A Game of Shadows,2011-11-22,"['Adventure', 'Action', 'Crime', 'Mystery']",DzPHzAR9GYw,"There is a new criminal mastermind at large (Professor Moriarty) and not only is he Holmes’ intellectual equal, but his capacity for evil and lack of conscience may give him an advantage over the  detective.",https://www.youtube.com/watch?v=DzPHzAR9GYw,"['paris, france', 'london, england', 'detective inspector', 'steampunk', 'criminal mastermind', '19th century', '1890s']",33.501,8027,7.1
51876,Limitless,2011-03-08,"['Thriller', 'Mystery', 'Science Fiction']",6d1Uc68wt3c,"A paranoia-fueled action thriller about an unsuccessful writer whose life is transformed by a top-secret ""smart drug"" that allows him to use 100% of his brain and become a perfect version of himself. His enhanced abilities soon attract shadowy forces that threaten his new life in this darkly comic and provocative film.",https://www.youtube.com/watch?v=6d1Uc68wt3c,"['new york city', 'medicine', 'politician', 'pill', 'iq', 'stalking', 'superhuman', 'writer', 'drugs', 'apartment', 'threat', 'knowledge', 'nootropics', 'mind booster']",23.538,8023,7.2
45243,The Hangover Part II,2011-05-25,['Comedy'],ohF5ZO_zOYU,"The Hangover crew heads to Thailand for Stu's wedding. After the disaster of a bachelor party in Las Vegas last year, Stu is playing it safe with a mellow pre-wedding brunch. However, nothing goes as planned and Bangkok is the perfect setting for another adventure with the rowdy group.",https://www.youtube.com/watch?v=ohF5ZO_zOYU,"['interpol', 'undercover cop', 'hangover', 'drugs', 'duringcreditsstinger']",58.98,7903,6.4
56292,Mission: Impossible - Ghost Protocol,2011-12-07,"['Action', 'Thriller', 'Adventure']",7wkih9Yvxq0,"Ethan Hunt and his team are racing against time to track down a dangerous terrorist named Hendricks, who has gained access to Russian nuclear launch codes and is planning a strike on the United States. An attempt to stop him ends in an explosion causing severe destruction to the Kremlin and the IMF to be implicated in the bombing, forcing the President to disavow them. No longer being aided by the government, Ethan and his team chase Hendricks around the globe, although they might still be too late to stop a disaster.",https://www.youtube.com/watch?v=7wkih9Yvxq0,"['submarine', 'prison', 'spy', 'terrorist', 'skyscraper', 'fight', 'sandstorm', 'russia', 'secret intelligence service', 'satellite', 'dubai', 'sequel', 'mission', 'explosion', 'broken arm', 'disguise', 'millionaire', 'nuclear threat', 'terrorist plot', 'spy hero', 'moscow, russia', ""world's tallest building"", 'kremlin']",38.275,7453,7
50619,The Twilight Saga: Breaking Dawn - Part 1,2011-11-16,"['Adventure', 'Fantasy', 'Romance']",PQNLfo-SOR4,The new found married bliss of Bella Swan and vampire Edward Cullen is cut short when a series of betrayals and misfortunes threatens to destroy their world.,https://www.youtube.com/watch?v=PQNLfo-SOR4,"['based on novel or book', 'vampire', 'werewolf', 'supernatural creature', 'dead', 'duringcreditsstinger', 'based on young adult novel']",84.562,6781,6.2
38356,Transformers: Dark of the Moon,2011-06-28,"['Action', 'Science Fiction', 'Adventure']",E-Sg_zJrDxc,"Sam Witwicky takes his first tenuous steps into adulthood while remaining a reluctant human ally of Autobot-leader Optimus Prime. The film centers around the space race between the USSR and the USA, suggesting there was a hidden Transformers role in it all that remains one of the planet's most dangerous secrets.",https://www.youtube.com/watch?v=E-Sg_zJrDxc,"['moon', 'spacecraft', 'traitor', 'bodyguard', 'alien planet', 'based on cartoon', 'transformers', 'giant robot', 'sabotage', 'word domination', 'commando', 'duringcreditsstinger']",13.081,6131,6.1
50544,Friends with Benefits,2011-07-21,"['Romance', 'Comedy']",MxfaGMuiniI,"Dylan and Jamie think it's going to be easy to add the simple act of sex to their friendship, despite what Hollywood romantic comedies would have them believe. They soon discover however that getting physical really does always lead to complications.",https://www.youtube.com/watch?v=MxfaGMuiniI,"['jealousy', 'friendship', 'love', 'friends', 'hospital', 'aftercreditsstinger', 'duringcreditsstinger']",25.957,6092,6.7
50646,"Crazy, Stupid, Love.",2011-07-29,"['Comedy', 'Drama', 'Romance']",flvz5RMRx7E,"Cal Weaver is living the American dream. He has a good job, a beautiful house, great children and a beautiful wife, named Emily. Cal's seemingly perfect life unravels, however, when he learns that Emily has been unfaithful and wants a divorce. Over 40 and suddenly single, Cal is adrift in the fickle world of dating. Enter, Jacob Palmer, a self-styled player who takes Cal under his wing and teaches him how to be a hit with the ladies.",https://www.youtube.com/watch?v=flvz5RMRx7E,"['soulmates', 'midlife crisis', 'marriage crisis', 'womanizer', 'law school', 'los angeles, california', 'crazy', 'relationship']",26.701,6000,7.2
45612,Source Code,2011-03-30,"['Thriller', 'Science Fiction', 'Mystery']",NkTrG-gpIzE,"Decorated soldier Captain Colter Stevens wakes up in the body of an unknown man, discovering he's involved in a mission to find the bomber of a Chicago commuter train. He learns he's part of a top-secret experimental program that enables him to experience the final 8 minutes of another person's life. Colter re-lives the train incident over and over again, gathering more clues each time.",https://www.youtube.com/watch?v=NkTrG-gpIzE,"['bomb', 'identity', 'bomber', 'suspicion', 'time travel', 'race against time', 'investigation', 'surrealism', 'time loop', 'soldier', 'helicopter pilot', 'time traveler']",22.846,5993,7.3
39254,Real Steel,2011-09-28,"['Action', 'Science Fiction', 'Drama']",s9aIuPSvXX8,"Charlie Kenton is a washed-up fighter who retired from the ring when robots took over the sport. After his robot is trashed, he reluctantly teams up with his estranged son to rebuild and train an unlikely contender.",https://www.youtube.com/watch?v=s9aIuPSvXX8,"['parent child relationship', 'fight', 'future', 'sports', 'robot', 'prizefight', 'father son reunion', 'robot fighting']",58.519,5831,6.9
51497,Fast Five,2011-04-20,"['Action', 'Thriller', 'Crime']",uSDNZeRX_1Y,"Former cop Brian O'Conner partners with ex-con Dom Toretto on the opposite side of the law. Since Brian and Mia Toretto broke Dom out of custody, they've blown across many borders to elude authorities. Now backed into a corner in Rio de Janeiro, they must pull one last job in order to gain their freedom.",https://www.youtube.com/watch?v=uSDNZeRX_1Y,"['car race', 'fbi', 'freedom', 'escaped convict', 'street race', 'prison escape', 'car crash', 'heist', 'organized crime', 'on the run', 'money', 'fugitive', 'police chase', 'car', 'duringcreditsstinger']",6.915,5783,7.2
59436,Midnight in Paris,2011-05-11,"['Fantasy', 'Comedy', 'Romance']",FAfR8omt-CY,A romantic comedy about a family traveling to the French capital for business. The party includes a young engaged couple forced to confront the illusion that a life different from their own is better.,https://www.youtube.com/watch?v=FAfR8omt-CY,"['paris, france', 'painter', 'detective', 'based on novel or book', 'screenwriter', 'camping', 'diary', 'forbidden love', 'time travel', 'midnight', 'nostalgia', 'versailles', 'sculpture', 'past', 'moulin rouge', 'wine tasting']",16.245,5478,7.5
44912,Green Lantern,2011-06-16,"['Adventure', 'Action', 'Thriller', 'Science Fiction']",W7w07MLhhb4,"For centuries, a small but powerful force of warriors called the Green Lantern Corps has sworn to keep intergalactic order. Each Green Lantern wears a ring that grants him superpowers. But when a new enemy called Parallax threatens to destroy the balance of power in the Universe, their fate and the fate of Earth lie in the hands of the first human ever recruited.",https://www.youtube.com/watch?v=W7w07MLhhb4,"['dc comics', 'transformation', 'superhero', 'based on comic', 'alien', 'alien infection', 'magical object', 'protector', 'based on graphic novel', 'super power', 'origin']",41.62,5474,5.2
44826,Hugo,2011-11-22,"['Adventure', 'Drama', 'Family']",gUthyrYwXUc,"Orphaned and alone except for an uncle, Hugo Cabret lives in the walls of a train station in 1930s Paris. Hugo's job is to oil and maintain the station's clocks, but to him, his more important task is to protect a broken automaton and notebook left to him by his late father. Accompanied by the goddaughter of an embittered toy merchant, Hugo embarks on a quest to solve the mystery of the automaton and find a place he can call home.",https://www.youtube.com/watch?v=gUthyrYwXUc,"['library', 'based on novel or book', 'movie business', 'clock', 'museum', 'key', 'toy', 'orphan', 'robot', 'automaton', 'hiding', 'filmmaking', 'leg brace', 'doberman', 'railway station', 'based on young adult novel']",25.386,5428,7.2
49013,Cars 2,2011-06-11,"['Animation', 'Family', 'Adventure', 'Comedy']",lg5hj2c5Nkk,Star race car Lightning McQueen and his pal Mater head overseas to compete in the World Grand Prix race. But the road to the championship becomes rocky as Mater gets caught up in an intriguing adventure of his own: international espionage.,https://www.youtube.com/watch?v=lg5hj2c5Nkk,"['car race', 'sequel', 'anthropomorphism', 'best friend', 'duringcreditsstinger']",65.533,5407,6
50014,The Help,2011-08-09,['Drama'],3eajzW3XW7Q,"Aibileen Clark is a middle-aged African-American maid who has spent her life raising white children and has recently lost her only son; Minny Jackson is an African-American maid who has often offended her employers despite her family's struggles with money and her desperate need for jobs; and Eugenia ""Skeeter"" Phelan is a young white woman who has recently moved back home after graduating college to find out her childhood maid has mysteriously disappeared. These three stories intertwine to explain how life in Jackson, Mississippi revolves around ""the help""; yet they are always kept at a certain distance because of racial lines.",https://www.youtube.com/watch?v=3eajzW3XW7Q,"['mississippi river', 'based on novel or book', 'exploitation', 'racial segregation', 'racism', 'writer', 'maid', 'moral courage', 'ressentiment', 'southern belle', 'racial issues', '1960s', 'newspaper columnist']",21.022,5370,8.2
65754,The Girl with the Dragon Tattoo,2011-12-14,"['Thriller', 'Crime', 'Mystery', 'Drama']",DqQe3OrsMKI,"This English-language adaptation of the Swedish novel by Stieg Larsson follows a disgraced journalist, Mikael Blomkvist, as he investigates the disappearance of a weary patriarch's niece from 40 years ago. He is aided by the pierced, tattooed, punk computer hacker named Lisbeth Salander. As they work together in the investigation, Blomkvist and Salander uncover immense corruption beyond anything they have ever imagined.",https://www.youtube.com/watch?v=DqQe3OrsMKI,"['rape', 'journalist', 'based on novel or book', 'journalism', 'island', 'hacker', 'nazi', 'punk', 'investigation', 'scandinavia', 'stockholm, sweden', 'remake', 'antisocial personality disorder', 'serial killer', 'disappearance', 'hacking', 'sadist', 'bible quote', 'dead cat', 'millennium', 'based on movie', 'abuse']",20.821,5088,7.3
37686,Super 8,2011-06-08,"['Thriller', 'Science Fiction', 'Mystery']",t-0XuYxh67w,"In 1979 Ohio, several youngsters are making a zombie movie with a Super-8 camera. In the midst of filming, the friends witness a horrifying train derailment and are lucky to escape with their lives. They soon discover that the catastrophe was no accident, as a series of unexplained events and disappearances soon follows. Deputy Jackson Lamb, the father of one of the kids, searches for the terrifying truth behind the crash.",https://www.youtube.com/watch?v=t-0XuYxh67w,"['1970s', 'secret', 'alien', 'train crash', 'firecracker', 'super 8mm', 'duringcreditsstinger']",21.929,5011,6.7
46195,Rio,2011-04-03,"['Animation', 'Adventure', 'Comedy', 'Family']",P1GRO31ve5Q,"Captured by smugglers when he was just a hatchling, a macaw named Blu never learned to fly and lives a happily domesticated life in Minnesota with his human friend, Linda. Blu is thought to be the last of his kind, but when word comes that Jewel, a lone female, lives in Rio de Janeiro, Blu and Linda go to meet her. Animal smugglers kidnap Blu and Jewel, but the pair soon escape and begin a perilous adventure back to freedom -- and Linda.",https://www.youtube.com/watch?v=P1GRO31ve5Q,"['pet', 'bird', 'parrot', 'musical', 'canary', 'jungle', 'samba', 'city', 'animal', 'duringcreditsstinger']",61.363,4865,6.7
51540,Horrible Bosses,2011-07-08,"['Comedy', 'Crime']",VpUeQV8sdOc,"For Nick, Kurt and Dale, the only thing that would make the daily grind more tolerable would be to grind their intolerable bosses into dust. Quitting is not an option, so, with the benefit of a few-too-many drinks and some dubious advice from a hustling ex-con, the three friends devise a convoluted and seemingly foolproof plan to rid themselves of their respective employers... permanently.",https://www.youtube.com/watch?v=VpUeQV8sdOc,"['conspiracy of murder', 'bad boss', 'employee', 'death of father', 'stakeout', 'duringcreditsstinger']",24.888,4843,6.6
49444,Kung Fu Panda 2,2011-05-25,"['Animation', 'Family']",FQ63rqSRrEI,"Po is now living his dream as The Dragon Warrior, protecting the Valley of Peace alongside his friends and fellow kung fu masters, The Furious Five - Tigress, Crane, Mantis, Viper and Monkey. But Po’s new life of awesomeness is threatened by the emergence of a formidable villain, who plans to use a secret, unstoppable weapon to conquer China and destroy kung fu. It is up to Po and The Furious Five to journey across China to face this threat and vanquish it. But how can Po stop a weapon that can stop kung fu? He must look to his past and uncover the secrets of his mysterious origins; only then will he be able to unlock the strength he needs to succeed.",https://www.youtube.com/watch?v=FQ63rqSRrEI,"['martial arts', 'hope', 'fleet', 'panda', 'friends', 'mission', 'woman director']",46.046,4810,6.8
44896,Rango,2011-03-02,"['Animation', 'Comedy', 'Family', 'Western', 'Adventure']",k-OOfW6wWyQ,"When Rango, a lost family pet, accidentally winds up in the gritty, gun-slinging town of Dirt, the less-than-courageous lizard suddenly finds he stands out. Welcomed as the last hope the town has been waiting for, new Sheriff Rango is forced to play his new role to the hilt.",https://www.youtube.com/watch?v=k-OOfW6wWyQ,"['sheriff', 'nevada', 'hero', 'pet', 'dystopia', 'lizard', 'outlaw', 'western', 'chameleon', 'construction site', 'armadillo', 'disillusionment', 'desert']",36.972,4549,6.7
39538,Contagion,2011-09-08,"['Drama', 'Thriller', 'Science Fiction']",4sYSyuuLk5g,"As an epidemic of a lethal airborne virus - that kills within days - rapidly grows, the worldwide medical community races to find a cure and control the panic that spreads faster than the virus itself.",https://www.youtube.com/watch?v=4sYSyuuLk5g,"['saving the world', 'mutation', 'infection', 'terminal illness', 'quarantine', 'outbreak', 'disease', 'vaccine', 'lethal virus', 'scientist', 'epidemic', 'medical drama']",48.346,4315,6.6
39513,Paul,2011-02-14,"['Adventure', 'Comedy', 'Science Fiction']",reo7zqvpdi0,"For the past 60 years, a space-traveling smart-ass named Paul has been locked up in a top-secret military base, advising world leaders about his kind. But when he worries he’s outlived his usefulness and the dissection table is drawing uncomfortably close, Paul escapes on the first RV that passes by his compound in Area 51. Fortunately, it contains the two earthlings who are most likely to rescue and harbor an alien on the run.",https://www.youtube.com/watch?v=reo7zqvpdi0,"['san diego, california', 'alien', 'area 51', 'alien space craft', 'duringcreditsstinger', '1980s']",35.201,4106,6.6
17578,The Adventures of Tintin,2011-10-25,"['Adventure', 'Animation', 'Mystery']",LTnCE_SaU38,"Intrepid young reporter, Tintin, and his loyal dog, Snowy, are thrust into a world of high adventure when they discover a ship carrying an explosive secret. As Tintin is drawn into a centuries-old mystery, Ivan Ivanovitch Sakharine suspects him of stealing a priceless treasure. Tintin and Snowy, with the help of salty, cantankerous Captain Haddock and bumbling detectives, Thompson and Thomson, travel half the world, one step ahead of their enemies, as Tintin endeavors to find the Unicorn, a sunken ship that may hold a vast fortune, but also an ancient curse.",https://www.youtube.com/watch?v=LTnCE_SaU38,"['riddle', 'captain', 'treasure', 'morocco', 'liquor', 'treasure hunt', 'based on comic', 'sunken treasure', 'plot', 'reporter', 'tintin', '1950s']",25.476,4045,6.8
50546,Just Go with It,2011-02-10,"['Comedy', 'Romance']",fpj7i2CPt8M,"A plastic surgeon, romancing a much younger schoolteacher, enlists his loyal assistant to pretend to be his soon to be ex-wife, in order to cover up a careless lie. When more lies backfire, the assistant's kids become involved, and everyone heads off for a weekend in Hawaii that will change all their lives.",https://www.youtube.com/watch?v=fpj7i2CPt8M,"['beach', 'fictitious marriage', 'blackmail', 'plastic surgery', 'marriage', 'love', 'beautiful woman', 'lies']",40.345,4040,6.6
49849,Cowboys & Aliens,2011-07-29,"['Action', 'Science Fiction', 'Thriller', 'Western']",OgBqfw0hINM,"A stranger stumbles into the desert town of Absolution with no memory of his past and a futuristic shackle around his wrist. With the help of mysterious beauty Ella and the iron-fisted Colonel Dolarhyde, he finds himself leading an unlikely posse of cowboys, outlaws, and Apache warriors against a common enemy from beyond this world in an epic showdown for survival.",https://www.youtube.com/watch?v=OgBqfw0hINM,"['robbery', 'sheriff', 'spacecraft', 'arizona', 'laser', 'apache', 'outlaw', 'ufo', 'alien', 'native american', 'escape', 'gunfight', 'alien invasion', '19th century']",32.973,3853,5.5
52449,Bad Teacher,2011-05-16,['Comedy'],GahC5cVsU6A,"A lazy, incompetent middle school teacher who hates her job and her students is forced to return to her job to make enough money for a boob job after her rich fiancé dumps her.",https://www.youtube.com/watch?v=GahC5cVsU6A,"['classroom', 'manipulation', 'teacher', 'school', 'student', 'middle school', 'incompetence', 'workplace comedy']",12.964,3666,5.5
46529,I Am Number Four,2011-02-18,"['Action', 'Thriller', 'Science Fiction', 'Adventure']",DdA0CrY1xks,"A teenage fugitive with an incredible secret races to stay one step ahead of the mysterious forces seeking destroy him in this sci-fi action thriller. With three dead and one on the run, the race to find the elusive Number Four begins. Outwardly normal teen John Smith never gets too comfortable in the same identity, and along with his guardian, Henri, he is constantly moving from town to town. With each passing day, John gains a stronger grasp on his extraordinary new powers, and his bond to the beings that share his fantastic fate grows stronger.",https://www.youtube.com/watch?v=DdA0CrY1xks,"['based on novel or book', 'secret identity', 'alien', 'heroism', 'teenage boy', 'super power', 'teenage hero', 'alien teenager', 'interspecies romance', 'based on young adult novel']",24.855,3619,6.2
