id,title,release_date,genres,video_key,overview,trailer_url,keywords,popularity,vote_count,vote_average
85032,Kotoko,2011-11-26,"['Drama', 'Horror']",ILChkxK-w70,"Suffering from double vision, a single mother (Cocco) tries to take care of her baby in the grip of terrifying hallucinations. Experiencing a nervous breakdown, she is deemed unfit to take care of her child and has it taken away from her. The only respite the mother has from her visions is when she sings. An award-winning novelist (Tsukamoto) overhears her singing whilst riding the bus and the pair subsequently develop a volatile relationship.",https://www.youtube.com/watch?v=ILChkxK-w70,"['single mother', 'mental illness']",3.962,47,7.1
81185,The Amityville Haunting,2011-12-27,['Horror'],J9bcgmZ-ZPM,"This movie is a 'found-footage' film about the Benson family who move in to the infamous house where the DeFeo family were murdered in the 1970s over 30 years earlier. Things start happening to anyone who visits this house, and whoever lives there. This is the footage retrieved from the camera.",https://www.youtube.com/watch?v=J9bcgmZ-ZPM,"['blood splatter', 'found footage']",7.209,47,4.3
70845,There's Something Wrong with Aunt Diane,2011-07-25,['Documentary'],Trck8tVtYyo,Filmmaker Liz Garbus investigates the mysterious tragedy of Diane Schuler in an effort to understand what went wrong.,https://www.youtube.com/watch?v=Trck8tVtYyo,"['car crash', 'dui', 'driving under the influence']",5.348,47,6.6
63144,Page One: Inside the New York Times,2011-04-29,['Documentary'],JLct9jNrFuo,Unprecedented access to the New York Times newsroom yields a complex view of the transformation of a media landscape fraught with both peril and opportunity.,https://www.youtube.com/watch?v=JLct9jNrFuo,[],5.436,47,6.8
63139,All Things Fall Apart,2011-03-05,['Drama'],qxR3xpp2TIY,50 Cent stars as gifted college running back Deon in this touching drama. Deon's world turns upside down when an unexpected crisis jeopardizes his professional ambitions -- and causes him to look at himself and his life in a new way.,https://www.youtube.com/watch?v=qxR3xpp2TIY,['sports'],7.859,47,5.9
53325,Eyyvah Eyvah 2,2011-01-07,['Comedy'],hLRZaVEuDGY,Second part of the turkish comedy film series.,https://www.youtube.com/watch?v=hLRZaVEuDGY,[],4.401,47,5.4
105945,Memorial Day,2011-06-06,"['Action', 'Drama', 'War', 'History']",,"Memorial Day, 1993. When 13-year-old Kyle Vogel discovers the World War II footlocker belonging to his grandfather, Bud, everyone tells Kyle to put it back. Luckily, he ignores them. Although Bud has never talked about the war, he finds himself striking a deal with his grandson: Kyle can pick any three souvenirs, and Bud will tell him the stories behind each one. Memorial Day not only takes us on a journey into Bud's complicated wartime past, but also into Kyle's wartime future. As the two men share parallel experiences in combat, they come to realize how that magical day on the porch shaped both of their lives. ",,"['war victim', 'military weapons', 'warbird', 'insurgent', 'army national guard', 'shrapnel', 'war souvenir', '1940s']",6.073,46,6.3
86577,Happy,2011-04-09,['Documentary'],JcMQmuvzPmI,"Happy is a 2011 feature documentary film directed, written, and co-produced by Roko Belic. It explores human happiness through interviews with people from all walks of life in 14 different countries, weaving in the newest findings of positive psychology. Director Roko Belic was originally inspired to create the film after producer/director Tom Shadyac (Liar, Liar, Patch Adams, Bruce Almighty) showed him an article in the New York Times entitled ""A New Measure of Well Being From a Happy Little Kingdom"". The article ranks the United States as the 23rd happiest country in the world. Shadyac then suggested that Belic make a documentary about happiness. Belic spent several years interviewing over 20 people, ranging from leading happiness researchers to a rickshaw driver in Kolkatta, a family living in a ""co-housing community"" in Denmark, a woman who was run over by a truck, a Cajun fisherman, and more.",https://www.youtube.com/watch?v=JcMQmuvzPmI,"['wellness', 'happiness', 'global']",5.48,46,7.1
83540,Dreams of a Life,2011-08-16,"['Documentary', 'Drama']",jSfXh8IJEg4,"A filmmaker sets out to discover the life of Joyce Vincent, who died in her bedsit in North London in 2003. Her body wasn't discovered for three years, and newspaper reports offered few details of her life - not even a photograph.",https://www.youtube.com/watch?v=jSfXh8IJEg4,['woman director'],5.55,46,6.8
81704,Romeos,2011-12-08,['Drama'],ZHFjDJzrjGE,"Lukas, 20, is a prisoner in his own body. As a pre-op transgendered person, he is constantly finding himself trapped in uncomfortable, compromising positions. His best friend, Ine introduces him to the gay scene in Cologne where he meets the confident and gorgeous, Fabio. The two develop a romantic relationship that tests the boundaries of love. ROMEOS forgoes stereotypes and conventions to offer an honest and humorous examination of the most basic of human conditions: friendship, sex, and love.",https://www.youtube.com/watch?v=ZHFjDJzrjGE,"['transgender', 'transsexual', 'lgbt', 'woman director']",4.667,46,6.7
80034,Earth's Final Hours,2011-05-31,['Science Fiction'],,"After dense matter from an imploded white hole hits Earth, the planet's rotation is devastated. A group of government agents must locate a lost satellite network that is the world's only hope for survival.",,"['satellite', 'white hole', 'rotation']",8.82,46,4.6
79040,Nova Zembla,2011-11-23,"['History', 'Drama']",dYBTl275lZQ,"Gerrit de Veer, a novice writer on a 16th-century Dutch merchant vessel, chronicles the daring mission to discover a trade route across the North Pole to Asia. But the heroic journey turns into tragedy when the ship gets stuck in the relentless, penetrating ice. The men are forced to spend the winter on the frozen, arctic wasteland of Nova Zembla, fighting polar bears, hunger and lethal temperatures. Their chances of making it until the following spring are virtually zero.",https://www.youtube.com/watch?v=dYBTl275lZQ,"['seefahrt', 'survival']",4.963,46,5.4
75562,Shun Li and the Poet,2011-09-23,['Drama'],d1Kg4u7sL5U,"A study of the friendship between a Chinese woman and a fisherman who came to Italy from Yugoslavia many years ago, who live in a small city-island in the Veneto lagoon.",https://www.youtube.com/watch?v=d1Kg4u7sL5U,[],3.122,46,7.2
72066,Children...,2011-02-17,"['Crime', 'Thriller', 'Drama']",,"The film is based on a true yet unsolved murder case from the early 1990s that is known among Koreans as the ""disappearance of the frog children."" In 1991, five elementary school students told their parents that they were going to hang out on a nearby mountain to catch frogs, and then they go missing.",,[],3.24,46,7.1
65945,Red Faction: Origins,2011-06-04,['Science Fiction'],,"In the year 2125, Alec Mason led the Martian Colonies to freedom in the hit action game Red Faction: Guerrilla. Now, Syfy and THQ are teaming up to continue the saga of conflict on Mars 25 years later in an all-new Original Movie, Red Faction: Origins. Stargate Universe's Brian J. Smith stars as Jake Mason, son of revolutionary hero Alec Mason (Terminator 2's Robert Patrick) and a Red Faction ranger. Fighting to preserve Martian freedom, Jake encounters a powerful new enemy in a dangerous and mysterious group led by the charismatic Adam Hale (Torchwood's Gareth David-Lloyd) and holding secrets that will rock the Mason clan. Jake must now battle the relentless regime and somehow reunite a family torn apart by war. Red Faction: Origins also stars Battlestar Galactica's Kate Vernon and The Tudors' Tamzin Merchant, and will feature music from Bear McCreary (Battlestar Galactica).",,"['planet mars', '22nd century']",6.102,46,5.3
58060,The Jewel,2011-03-04,['Drama'],,"Amanzio Rastelli appointed several of his relations to managerial positions in his firm. They decided to think internationally and now business is heavily in debt. Luckily for the Rastellis, Bolta the accountant uses all the tricks of his art to cook the books, but catastrophe awaits.",,[],3.006,46,6.7
53101,Manborg,2011-10-25,"['Horror', 'Science Fiction']",zhF6BLFBm9c,"The evil Count Draculon and his army of demons have conquered Earth, but a young soldier who lost his life in the first war against Hell has reawakened in the future as MANBORG! Together with a crew of post-apocalyptic rebels, the half-man half-machine hero will fight to defeat Draculon and take back the planet!",https://www.youtube.com/watch?v=zhF6BLFBm9c,"['cyborg', 'dystopia']",5.089,46,5.2
452830,Black Mirror,2011-06-20,['Drama'],,"A nameless drifter navigates a barren landscape punctuated by satellite dishes, radio towers and droning airplanes. Stopping periodically in anonymous hotel rooms, she makes attempts to connect to an unidentified second party.",,"['travel', 'art installation', 'short']",4.991,45,7.5
101733,Zombie Ass: Toilet of the Dead,2011-09-24,"['Comedy', 'Horror']",BJImnJ-GD_I,"Wracked with guilt over the suicide of her sister Ai, who was tormented by high school bullies, pretty young karate student Megu accompanies a group of older friends on a camping trip into the woods: smart girl Aya, her druggie boyfriend Také, big-boobed model Maki, and nerdy Naoi. Things start to go badly when Maki finds a parasitical worm inside a fish they catch – and wolfs it down alive, in the hope that it’ll help keep her skinny! Soon after, and not so unexpectedly in situations like this, zombies show up and begin to complicate things further. After they’re attached by a crowd of poop-covered undead who emerge from an outhouse toilet, the group seeks refuge at the home of strange Dr. Tanaka and his daughter Sachi. But unbeknownst to them, Tanaka has been conducting experiments on the parasites—and the zombies!—and has another fate in mind for the five strangers from the city.",https://www.youtube.com/watch?v=BJImnJ-GD_I,"['japan', 'fish', 'toilet', 'zombie', 'parasite', 'tapeworms']",13.059,45,4.7
89623,"Leafie, a Hen Into the Wild",2011-07-28,"['Adventure', 'Animation', 'Drama', 'Family']",wENxx-3jYnI,"Based on a bestselling preteen novel of the same title that has sold more than 1 million copies in Korea, “Leafie, A Hen into the Wild” is about a laying hen named Leafie who is destined to live the “same old” repetitive life confined on the chicken farm.  Her fate changes when she escapes from the chicken farm and hatches a duck egg. With the duckling (who believes Leafie to be his mother), sets off on a journey into the wild with her new son to find her freedom.",https://www.youtube.com/watch?v=wENxx-3jYnI,"['based on novel or book', 'anthropomorphism', 'animal', 'kodomo']",8.76,45,7.2
85743,Play,2011-05-15,"['Crime', 'Drama']",6UsE80g0qeE,"In central Gothenburg, Sweden, a group of boys, aged 12-14, robbed other children on about 40 occasions between 2006 and 2008. The thieves used an elaborate scheme called the 'little brother number' or 'brother trick', involving advanced role-play and gang rhetoric rather than physical violence.",https://www.youtube.com/watch?v=6UsE80g0qeE,[],3.701,45,7
85317,Six Degrees of Celebration 2,2011-12-15,"['Comedy', 'Romance']",ylAfpRKeT-k,"A lot of things happened in the life of ""Yolki"" hepes during the last year, but here it's again - the New Year's eve...",https://www.youtube.com/watch?v=ylAfpRKeT-k,"[""new year's eve""]",4.193,45,6.9
84449,Remains,2011-12-06,"['Drama', 'Horror', 'Action', 'Thriller']",MJq2ddpm4RE,The story centers on two lone survivors of a bizarre accident that reduced most of the world's population to zombies. They take refuge in a vacant casino and fight a losing battle against the undead.,https://www.youtube.com/watch?v=MJq2ddpm4RE,[],5.781,45,4.6
79699,A Warrior's Heart,2011-12-02,"['Action', 'Drama', 'Family']",Hepw_8fLhMI,"Unable to cope with his military father's sudden death in combat, quick-tempered teen, Conor, starts getting into serious trouble. During an intense lacrosse camp, his father's old friend challenges Conor to get his life on track and become a man.",https://www.youtube.com/watch?v=Hepw_8fLhMI,"['coach', 'high school sports', 'death of father', 'lacrosse', 'rebellion', 'camp', 'teenage love', 'self destructiveness']",5.945,45,5.5
76788,Mankatha,2011-08-31,"['Action', 'Thriller']",vHESM8iR1JE,"Vinayak, a suspended cop, helps a group of four men rob cricket betting money amounting to 500 crores INR. When it comes to splitting the amount, betrayal hits the team hard and a chase ensues.",https://www.youtube.com/watch?v=vHESM8iR1JE,"['gambling', 'money laundering', 'cricket', 'heist', 'bad cop', 'cops and robbers\xa0', 'bookie']",3.005,45,6.7
71744,Eating Out: Drama Camp,2011-07-01,['Comedy'],ZFttDYb1pqs,"Zack and Casey's relationship is in a slump, but things are about to change at Dick Dickey's Drama Camp. Zack meets gorgeous Benji, and when they get cast as lovers in a sexed-up version of The Taming of the Shrew, their self-restraint is put to the test. Will Zack and Casey's relationship last with Benji in the picture?",https://www.youtube.com/watch?v=ZFttDYb1pqs,"['summer camp', 'gay interest', 'play', 'lgbt', 'sex comedy', 'flirting', 'trans woman', 'drama club', 'gay couple', 'gay', 'gay relationship', 'shakespeare']",6.043,45,5.9
268874,Contratiempo,2011-01-01,[],,A race against time between a man whose son requires urgent treatment and a stockbroker who suddenly lost his investors' money and ruined his own family.,,[],3.658,44,8.7
122372,The Ghostmaker,2011-08-01,"['Horror', 'Science Fiction', 'Thriller']",7y-a0RlEfcM,"A group of college friends discover a 15th century coffin that allows them to experience the world as ghosts. While their first adventures in the spirit world are playful and innocent, the ""Box of Shadows"" soon brings out the group's most dangerous impulses and desires. The friends find themselves pulled into a world of evil where they learn the line between life and death is there for a reason.",https://www.youtube.com/watch?v=7y-a0RlEfcM,"['coffin', 'college', 'ghost']",5.829,44,5.2
103516,Private Romeo,2011-06-20,"['Drama', 'Romance']",Wndqio-IbXQ,"When eight male cadets are left behind at an isolated military high school, the greatest romantic drama ever written seeps out of the classroom and permeates their lives.",https://www.youtube.com/watch?v=Wndqio-IbXQ,"['cadet', 'kiss', 'uniform', 'gym', 'lgbt', 'shakespeare in modern dress', 'military academy']",5.164,44,5.9
94354,Eating Out: The Open Weekend,2011-10-08,"['Comedy', 'Romance']",U4w-OuCh4Kw,"Sexy couple Zack and Benji decide to have an “open” weekend to partake in the smorgasbord of available men on their vacation to a gay getaway in Palm Springs. When Zack runs into his ex-boyfriend Casey at the resort, they both do their best to look like they are having a good time. How could they not, when they are surrounded by cute, frisky guys with six-packs and very little clothing?",https://www.youtube.com/watch?v=U4w-OuCh4Kw,"['vacation', 'gay interest', 'promiscuity', 'palm springs', 'resort', 'lgbt', 'sex comedy', 'foursome', 'hookup', 'gay', 'gay relationship']",17.06,44,5.8
87019,Body Language,2011-10-06,"['Music', 'Drama', 'Romance']",,"An hour before the five best Dutch dance crews fly to a contest in New York, the subsidized trip is cancelled. Five dancers from totally different crews don't want to give up their free plane ticket and go anyway. In New York they realize what they've done. They have no money, no plan and no crew. But... They came to dance so there is only one thing to do. Together they form a new crew and do everything they can to enter the contest they came for. In the mean time... they have to survive two weeks in New York without any cash. Written by Tijs van Marle",,[],2.452,44,5.4
72551,Footnote,2011-05-25,['Comedy'],8dwe7GR9kO4,"Jerusalem, Israel. Professors Eliezer and Uriel Shkolnik, father and son, have dedicated their lives to the study of the Jewish scriptures. Eliezer is a stubborn and methodical scholar who has never been recognized for his work; Uriel is a rising star, someone admired and praised by his colleagues. The fragile balance that has kept their personal relationship almost intact is broken in an unexpected way by a simple phone call.",https://www.youtube.com/watch?v=8dwe7GR9kO4,"['jerusalem, israel', 'black humor', 'family secrets', 'jewish culture', 'talmud', 'awards show', 'scholar', 'father son conflict', 'father son relationship', 'hebrew language']",3.929,44,7.3
70862,American Grindhouse,2011-02-04,['Documentary'],AndtsMdk2fc,This documentary explores the hidden history of the American Exploitation Film. The movie digs deep into this often overlooked category of U.S. cinema and unearths the shameless and occasionally shocking origins of this popular entertainment.,https://www.youtube.com/watch?v=AndtsMdk2fc,"['movie business', 'exploitation', 'grindhouse', 'film production']",4.975,44,6.8
56591,Corman's World,2011-12-16,['Documentary'],ngsD17ZAglE,"A chronicle of the long career of American filmmaker Roger Corman, the most tenacious and ingenious low-budget producer and director in the US film industry, a pioneer of independent filmmaking and discoverer of new talent.",https://www.youtube.com/watch?v=ngsD17ZAglE,"['movie business', 'low-budget', 'woman director', 'portrait of an artist', 'portrait of a filmmaker', 'cinema on cinema']",6.145,44,7.2
82321,The Loneliest Planet,2011-08-10,['Drama'],lv2lP-MS_LE,"Backpacking in the Caucasus Mountains, walking for hours, an engaged couple and their tour guide trade anecdotes and play games to pass the time, until a momentary misstep, that takes only two or three seconds, changes everything.",https://www.youtube.com/watch?v=lv2lP-MS_LE,['woman director'],5.438,43,5.9
59441,A Bag of Hammers,2011-03-12,"['Comedy', 'Drama']",Kt2Kt_o25v0,"Two misfit best friends incapable of growing up, whose direction is tested by an abandoned child, worn beyond his years; together they invent the family they've always needed.",https://www.youtube.com/watch?v=Kt2Kt_o25v0,"['suicide', 'california', 'alcohol', 'waitress', 'fight', 'misfit', 'bully', 'theft', 'criminal', 'argument', 'con', 'homeless']",6.537,43,6.1
120811,K-ON! The Movie,2011-12-03,"['Animation', 'Family', 'Adventure', 'Comedy', 'Music']",,"Graduation draws near for Yui, Ritsu, Mio and Tsumugi, the four 3rd-year students of the Light Music Club. They, together with Azusa, decide to go on a post-graduation trip. Their destination, decided by lot, is London!",,"['london, england', 'japan', 'england', 'music', 'high school', 'sushi', 'slice of life', 'singing', 'woman director', 'anime', 'high school band']",8.96,42,7.8
91052,18 Years Old and Rising,2011-07-20,['Comedy'],,"Primo is an ordinary middle-class youngster studying for his baccalaureate, who gets side-tracked when he falls in love with a rich girl. They soon learn they have to deal with her condescending friends who look down upon this upstart.",,[],2.969,42,5.5
83880,Super Shark,2011-12-08,"['Action', 'Adventure', 'Comedy', 'Science Fiction']",g1AN3FEpkT8,"An offshore drilling accident triggers the release of a giant prehistoric shark. When marine biologist Kat Carmichael arrives, she runs up against corporate front man Roger Wade, who plots with Stewart to disrupt her investigation. With the help of Skipper Chuck and disc jockey Dynamite Stevens, Kat tries to find a way to defeat the monster which has evolved to a state where it can walk on dry land and fly...it's the SUPER SHARK!",https://www.youtube.com/watch?v=g1AN3FEpkT8,"['shark attack', 'marine biologist', 'los angeles, california', 'shark']",7.734,42,4
81460,Hindsight,2011-08-31,"['Action', 'Drama']",c3ceUMbElg4,A young assassin is sent to kill a retired mob boss. But things get complicated when she begins to like him.,https://www.youtube.com/watch?v=c3ceUMbElg4,"['assassin', 'cooking', 'friendship', 'love', 'deception', 'mafia']",4.258,41,6.6
80544,A Christmas Wish,2011-11-20,"['Family', 'Drama', 'Comedy', 'TV Movie']",hf37mVQtg-g,"MARTHA EVANS has been abandoned by her ne'er-do-well husband, who took all their cash and left her homeless and virtually destitute with her two daughters and stepson. Martha leaves town in hopes of finding a job and a place to stay, she finally finds a job at a sleepy rural diner, formerly famous for its home-made root beer. But with her car broken down and the bills piling up, it looks like it's going to be a bleak Christmas for the Evans family. However, there are warm hearts working behind the scenes that ultimately make this the happiest holiday of Martha's life -- a real answer to her prayers",https://www.youtube.com/watch?v=hf37mVQtg-g,"['prayer', 'bullying', 'single mother', 'car trouble', 'holiday season', 'christmas']",8.087,42,5.8
65892,My Future Boyfriend,2011-04-10,['Comedy'],,"P-A-X-497/341, aka “Pax” , a curious young man from the well-ordered but loveless future, travels to present day New Orleans in search of romance novelist Elizabeth Barrett – whose book he has come upon during an archeological dig in the year 3127. Hoping Elizabeth can explain the concept of love to him, which is now nonexistent in his time, Pax embarks on an adventure filled with new discoveries. Elizabeth introduces Pax to life in the year 2011, filled with love, music and of course, destiny. When Pax doesn’t return to the future by the given deadline, Bob, his fellow scientist, travels back in time to find him. Meanwhile, as Elizabeth helps Pax learn about love, she ends up confiding in her colleague, played by Valerie Harper, about her own upcoming “surprise” engagement.",,[],5.518,42,5.1
64835,Corpo Celeste,2011-05-20,['Drama'],TS3SrQaRqmg,"After growing up in Switzerland, 13-year-old Marta returns to a city in southern Italy with her mother and older sister. Independent and inquisitive, she joins a catechism class at a local church. However, the games and religious pop songs she encounters there do not nearly satisfy her interest in faith. Struggling to find her place, Marta pushes the boundaries of the class, the priest, and the church.",https://www.youtube.com/watch?v=TS3SrQaRqmg,['woman director'],3.17,42,7.1
62425,Talking Funny,2011-04-22,"['Comedy', 'Documentary']",,"What does it mean to be a successful comedian? How far can the boundaries of taste be pushed to get a laugh? Four top comics, Ricky Gervais, Louis C.K., Jerry Seinfeld and Chris Rock, discuss and debate their craft.",,[],5.393,42,7.4
57417,Borderline,2011-03-02,"['Comedy', 'Action', 'Crime']",,An attorney stumbles upon a suitcase filled with cocaine.,,"['gun', 'family relationships', 'lawyer', 'loss of job', 'hanging', 'based on short story', 'money problems']",5.419,42,5.3
289097,Cell 213,2011-06-10,['Horror'],,"Cocky young attorney Michael Gray finds himself framed for murder when an inmate he is defending violently kills himself during their interview at South River State Penitentiary. Now locked in the same nightmarish Cell 213 where his client died, he soon realizes that unnatural forces are behind a string of inmate suicides, making matters of guilt and innocence not as cut and dry as they seem.",,[],5.301,41,5.4
127880,Clandestine Childhood,2011-09-20,['Drama'],sYOmwFQVdFU,"Juan lives in clandestinity. Just like his mum, his dad and his adored uncle Beto, outside his home he has another name. At school, Juan is known as Ernesto. And he meets María, who only has one name. Based on true events, set in the Argentina of 1979, this film is one about love.",https://www.youtube.com/watch?v=sYOmwFQVdFU,[],3.069,41,7
92493,Edwin Boyd: Citizen Gangster,2011-09-10,"['Crime', 'Drama']",cKPu7I2nMFQ,"Based on a real WWII vet and family man turned bank robber. Disillusioned by his post war circumstances, Eddie Boyd is torn between the need to provide for his young family and an unfulfilled dream to head to Hollywood to become a star. He discovers a way to do both, robbing banks Hollywood style, but his dream leads him down a path of danger and tragedy.",https://www.youtube.com/watch?v=cKPu7I2nMFQ,"['police brutality', 'toronto, canada', 'bus driver', 'prison escape', 'true crime', 'war bride', 'wooden leg', 'post war', 'struggling actor', 'gentleman thief', 'man in wheelchair', 'prison brawl']",7.309,41,5.6
82914,Fastest,2011-09-20,['Documentary'],Cq1f_UzflsI,"What does it take to be the fastest? From award-winning filmmaker Mark Neale, comes Fastest, a spectacular maximum-speed, full-length documentary delving deep into the world of MotoGP™. This thrilling documentary, narrated by Ewan McGregor, highlights the thrills, spills and incredible commitment and courage the sport demands of it stars. With unprecedented behind-the-scenes access and never before seen angles, interviews and insight, this truly cinematic experience charts the exhilarating highs, crushing lows, career-threatening crashes and spectacular comebacks, including Rossi’s 41 days turn around to race following a leg shattering crash.",https://www.youtube.com/watch?v=Cq1f_UzflsI,"['sports', 'biker', 'motor sport', 'motogp', '2010s']",8.11,41,6.9
81330,Desperately Seeking Santa,2011-11-27,"['Romance', 'TV Movie']",,"Jennifer, a young, ambitious executive running promotions at a failing Boston mall comes up with a genius promotional gimmick to save her workplace and position herself for advancement: hold a ""Hunky Santa"" contest to replace the old Mall Santa. David, a local man trying to save his family's pizzeria, ultimately wins the contest and sparks fly between him and Jennifer. However, complications ensue when it comes to light that the company Jennifer works for is the same one trying to run David's family out of business.",,"['holiday', 'santa claus', 'pizzeria', 'contest', 'christmas']",7.91,41,6.1
