id,title,release_date,genres,video_key,overview,trailer_url,keywords,popularity,vote_count,vote_average
79120,Weekend,2011-09-22,"['Drama', 'Romance']",jIOjW4kdU_A,"After a drunken house party with his straight mates, Russell heads out to a gay club. Just before closing time he picks up Glen but what's expected to be just a one-night stand becomes something else, something special.",https://www.youtube.com/watch?v=jIOjW4kdU_A,"['one-night stand', 'romance', 'independent film', 'gay interest', 'nottingham', 'gay club', 'club', 'lgbt', 'gay', 'gay relationship']",11.065,383,7.3
49010,Hobo with a Shotgun,2011-05-06,"['Crime', 'Action', 'Thriller']",ssHEAOrAdCU,"A vigilante homeless man pulls into a new city and finds himself trapped in urban chaos, a city where crime rules and where the city's crime boss reigns. Seeing an urban landscape filled with armed robbers, corrupt cops, abused prostitutes and even a pedophile Santa, the Hobo goes about bringing justice to the city the best way he knows how - with a 20-gauge shotgun. Mayhem ensues when he tries to make things better for the future generation. Street justice will indeed prevail.",https://www.youtube.com/watch?v=ssHEAOrAdCU,"['prostitute', 'shotgun', 'pimp', 'dystopia', 'vigilante', 'massacre', 'brutality', 'violence', 'white suit']",8.212,380,5.8
77944,The Worst Week of My Life,2011-10-27,['Comedy'],,"Seven days before his wedding, a man must contend with a series of never-ending disasters.",,[],5.031,375,6.1
51588,Prom,2011-04-29,"['Comedy', 'Romance']",VGCtgUNgZKs,"At “Prom,” every couple has a story and no two are exactly alike. As the big dance approaches for Nova Prescott, it’s a battle of wills as she finds herself drawn to the guy who gets in the way of her perfect prom. Fellow seniors Mei and Tyler harbor secrets, while others face all the insecurity and anticipation that surrounds one of high school’s most seminal events.",https://www.youtube.com/watch?v=VGCtgUNgZKs,"['single parent', 'waitress', 'fountain', 'friendship', 'high school', 'prom', 'music fan']",12.375,372,6.1
61667,We Have a Pope,2011-04-15,"['Drama', 'Comedy']",xjPBUSzK_IE,"The newly elected Pope suffers a panic attack just as he is about to greet the faithful who have gathered to see him. His advisors, unable to convince him he is the right man for the job, call on a renowned therapist who also happens to be an atheist. But the Pope's fear of his newfound responsibility is one he must face alone. Winner Best Film at the Italian Golden Globes.",https://www.youtube.com/watch?v=xjPBUSzK_IE,"['vatican', 'pope', 'psychology', 'dilemma', 'spirituality', 'catholicism']",9.602,372,6.8
59115,Quarantine 2: Terminal,2011-06-16,"['Horror', 'Mystery', 'Science Fiction']",9o4f2QAU_4s,A plane is taken over by a mysterious virus. When the plane lands it is placed under quarantine. Now a group of survivors must band together to survive the quarantine.,https://www.youtube.com/watch?v=9o4f2QAU_4s,[],21.21,372,5.6
74945,War of the Buttons,2011-09-20,"['Adventure', 'Family']",B2zk9iCXZLU,"Occupied France; Lebrac leads a play war between two rival kid gangs, but a girl he likes, who's Jewish, is in danger of being discovered by local Nazi sympathisers. Lebrac and the village must now respond to the reality of what's happening.",https://www.youtube.com/watch?v=B2zk9iCXZLU,"['based on novel or book', 'remake', 'button', 'war context', '1940s', 'occupied france', 'children in wartime']",5.998,367,6
63197,Megan Is Missing,2011-05-01,"['Drama', 'Horror', 'Thriller']",qolORalWZUw,"Fictional drama based on actual events, about two teenage girls who encounter an Internet predator.",https://www.youtube.com/watch?v=qolORalWZUw,"['rape', 'predator', 'camcorder', 'based on a true story', 'murder', 'teenage girl', 'internet', 'torture', 'high school friends', 'missing person', 'found footage', 'abduction']",34.292,364,6.1
82424,Small Fry,2011-11-23,"['Animation', 'Family', 'Comedy']",,A fast food restaurant mini variant of Buzz forcibly switches places with the real Buzz and his friends have to deal with the obnoxious impostor.,,"['fast food restaurant', 'toy', 'fast food', 'short']",12.523,362,6.8
65055,Shark Night 3D,2011-09-02,"['Horror', 'Thriller']",nDmLLGTQlXY,A weekend at a lake house in the Louisiana Gulf turns into a nightmare for seven vacationers as they are subjected to fresh-water shark attacks.,https://www.youtube.com/watch?v=nDmLLGTQlXY,"['shark attack', 'louisiana', 'dirty cop', 'shark', 'aftercreditsstinger']",15.846,363,5
63207,Intruders,2011-09-12,"['Thriller', 'Horror', 'Fantasy']",9FE616lUkuU,"Though no one can see him, Hollow Face lurks in the corners, desperately desiring love but only knowing how to spread fear and hate. He creeps into the life of John Farrow after Farrow’s beloved 13-year-old daughter Mia is assaulted in their home. The line between the real and the imaginary blurs as fissures start to open within the family unit. It seems that no security measure can keep Hollow Face out.",https://www.youtube.com/watch?v=9FE616lUkuU,"['construction site', 'protective father']",12.611,358,5.4
65851,Jackass 3.5,2011-05-12,"['Comedy', 'Documentary', 'Action']",bR26swEzZ84,"Jackass 3.5 is a 2011 sequel to Jackass 3D, composed of unused footage shot during the filming of Jackass 3D and interviews from cast and crew",https://www.youtube.com/watch?v=bR26swEzZ84,"['snake', 'buffalo', 'electric shock', 'bungee-jump', 'stunt', 'stuntman', 'stupidity', 'trumpet', 'sequel', 'old man']",12.559,355,6.2
85435,A Few Best Men,2011-10-14,['Comedy'],xSzCVYD7C4w,A comedy about a groom and his three best men who travel to the Australian outback for a wedding.,https://www.youtube.com/watch?v=xSzCVYD7C4w,"['drug dealer', 'best friend', 'wedding', 'australian outback']",8.828,349,5.8
81390,A Lonely Place to Die,2011-04-09,"['Adventure', 'Action', 'Thriller', 'Crime']",MhfbdaQ_ub0,A group of five mountaineers are hiking and climbing in the Scottish Highlands when they discover a young Serbian girl buried in a small chamber in the wilderness. They become caught up in a terrifying game of cat and mouse with the kidnappers as they try to get the girl to safety.,https://www.youtube.com/watch?v=MhfbdaQ_ub0,"['scotland', 'kidnapping', 'wilderness', 'mountaineer', 'hiking', 'climbing']",22.084,348,6
71689,Phineas and Ferb the Movie: Across the 2nd Dimension,2011-08-05,"['Animation', 'Comedy', 'Family', 'TV Movie', 'Music']",jwfNAPIfip4,"Perry's worst fear comes true when Phineas and Ferb finds out that he is in fact Secret Agent P, but that soon pales in comparison during a trip to the 2nd dimension where Perry finds out that Dr. Doofenshmirtz is truly evil and successful.",https://www.youtube.com/watch?v=jwfNAPIfip4,"['sibling relationship', 'monster', 'one-sided love', 'secret agent', 'alternate dimension', 'growing up', 'mad scientist', 'dating', 'teenager', 'super villain', 'pet owner reunion', 'phineas and ferb']",22.611,346,6.8
70577,Faces in the Crowd,2011-10-25,"['Crime', 'Drama', 'Mystery', 'Thriller']",xNf5ja-p_ao,"A horror-thriller centered on a woman living with ""face-blindness"" after surviving a serial killer's attack. As she lives with her condition, one in which facial features change each time she loses sight of them, the killer closes in.",https://www.youtube.com/watch?v=xNf5ja-p_ao,"['detective', 'murder', 'serial killer', 'disorder']",9.395,345,6.1
64639,Straw Dogs,2011-09-16,"['Drama', 'Thriller']",MeE-qTiaFT4,"L.A. screenwriter David Sumner relocates with his wife, Amy, to her hometown in the deep South. There, while tensions build between them, a brewing conflict with locals becomes a threat to them both.",https://www.youtube.com/watch?v=MeE-qTiaFT4,"['southern usa', 'rape', 'bar', 'husband wife relationship', 'barn', 'machismo', 'rifle', 'home invasion']",10.238,340,5.8
74513,Special Forces,2011-11-02,"['Action', 'Drama', 'War']",Ke3ZSQe8SiM,"Afghanistan. War correspondent Elsa Casanova is taken hostage by the Taliban. Faced with her imminent execution, a Special Forces unit is dispatched to free her. In some of the world’s most breathtaking yet hostile landscapes, a relentless pursuit begins between her kidnappers who have no intention of letting their prey escape them and a group of soldiers who risk their lives in pursuit of their single aim – to bring her home alive. This strong, independent woman and these men of duty are thrown together and forced to confront situations of great danger that inextricably bind them – emotionally, violently and intimately.",https://www.youtube.com/watch?v=Ke3ZSQe8SiM,"['journalist', 'kidnapping', 'afghanistan', 'pakistan', 'taliban', 'rescue', 'war zone']",20.361,339,6.7
43935,Dylan Dog: Dead of Night,2011-03-16,"['Action', 'Comedy', 'Horror', 'Mystery', 'Science Fiction', 'Thriller']",_mqp4QA9Om0,"Supernatural private eye, Dylan Dog, seeks out the monsters of the Louisiana bayou in his signature red shirt, black jacket and blue jeans.",https://www.youtube.com/watch?v=_mqp4QA9Om0,"['detective', 'vampire', 'supernatural', 'zombie', 'werewolf', 'ghouls']",10.203,338,4.4
65291,Green Lantern: Emerald Knights,2011-04-09,"['Action', 'Adventure', 'Animation', 'Science Fiction', 'Drama']",xTvGvI2KPoI,"As the home planet of the Green Lantern Corps faces a battle with an ancient enemy, Hal Jordan prepares new recruit Arisia for the coming conflict by relating stories of the first Green Lantern and several of Hal's comrades.",https://www.youtube.com/watch?v=xTvGvI2KPoI,"['dc comics', 'superhero', 'based on comic', 'super power', 'woman director']",75.31,332,6.6
55725,Win Win,2011-03-18,"['Comedy', 'Drama']",_TfeGeg6Erg,"When down-on-his-luck part-time high school wrestling coach Mike agrees to become legal guardian to an elderly man, his ward's troubled grandson turns out to be a star grappler, sparking dreams of a big win -- until the boy's mother retrieves him.",https://www.youtube.com/watch?v=_TfeGeg6Erg,"['new jersey', 'sports', 'coach', 'lawyer', 'wrestling coach']",9.437,332,6.8
79108,Starbuck,2011-01-01,['Comedy'],,"Starbuck is a 2011 Canadian comedy film directed by Ken Scott and written by Martin Petit and Ken Scott. The main character David Wozniak is a perpetual adolescent who discovers that, as a sperm donor, he has fathered 533 children. David, a deliveryman for a butcher shop, is being pursued by thugs because he owes them money. Next, he is advised that more than 100 of his offspring are trying to force the fertility clinic to reveal the true identity of ""Starbuck"", the pseudonym he used when donating sperm. In addition, his girlfriend Valérie is pregnant with his child but doesn't feel that he is mature enough to be a father. The film's title refers to a Canadian Holstein bull who produced hundreds of thousands of progeny by artificial insemination in the 1980s and 1990s.",,"['sperm bank', 'lawsuit', 'man child', 'sperm donor', 'artificial insemination', 'loan shark']",6.983,329,6.9
65599,The Woman,2011-10-14,"['Drama', 'Horror']",GL50yBcw5wA,A lawyer puts his family in jeopardy when he captures the last member of a violent clan and tries to forcibly tame her.,https://www.youtube.com/watch?v=GL50yBcw5wA,"['wound', 'suffering', 'sadism', 'gore', 'torture', 'violent death', 'brutality']",13.378,328,6.1
85735,Love Lasts Three Years,2011-12-10,"['Romance', 'Comedy']",,"A heartbroken literary critic turns his despair into creativity following a bitter divorce, only to encounter an enchanting beauty who poses a major challenge to his newfound cynicism. Marc Marronnier thought his marriage was going well until his wife deemed him immature, and left him for a high-profile writer. Devastated, he began filtering all of his heartache into a misanthropic manuscript decrying the virtues of true love. But later, when Marc falls hard for his cousin's radiant and gorgeous wife, his entire life is turned upside down. Louise Bourgoin and Gaspard Proust star in a film by actor and author-turned-director Frederic Beigbeder.",,[],4.752,323,5.7
72477,Texas Killing Fields,2011-10-14,"['Drama', 'Thriller', 'Crime', 'Mystery']",7woppidfvtc,"In the Texas bayous, a local homicide detective teams up with a cop from New York City to investigate a series of unsolved murders.",https://www.youtube.com/watch?v=7woppidfvtc,"['torture', 'series of murders', 'multiple murder', 'woman director']",9.402,322,5.8
73873,Albert Nobbs,2011-12-21,['Drama'],Ne1MfS191gs,"Albert Nobbs struggles to survive in late 19th century Ireland, where women aren't encouraged to be independent. Posing as a man, so she can work as a butler in Dublin's most posh hotel, Albert meets a handsome painter and looks to escape the lie she has been living.",https://www.youtube.com/watch?v=Ne1MfS191gs,"['butler', 'dublin, ireland', 'maid']",14.198,321,6.3
66118,Case départ,2011-07-05,['Comedy'],,Two contempo Frenchmen of Antillean descent visit their ancestor's time as well as their land in the slavery-themed French era.,,['time travel'],5.032,321,6
81342,Delicacy,2011-12-20,"['Drama', 'Comedy', 'Romance']",,A French woman mourning over the death of her husband three years prior is courted by a Swedish co-worker.,,"['france', 'love', 'fate', 'cafe', 'swedish', 'pez dispenser', 'office romance']",8.265,320,6.4
54518,Justin Bieber: Never Say Never,2011-02-11,"['Music', 'Documentary', 'Family']",COJCN3Mhr14,"Tells the story of Justin Bieber, the kid from Canada with the hair, the smile and the voice: It chronicles his unprecedented rise to fame, all the way from busking in the streets of Stratford, Canada to putting videos on YouTube to selling out Madison Square Garden in New York as the headline act during the My World Tour from 2010. It features Usher, Scooter Braun, Ludacris, Sean Kingston, Antonio ""L.A."" Reid, Boyz II Men, Miley Cyrus, Jaden Smith, Justin's family members and parts of his crew and huge fanbase in a mix of interviews and guest performances. It was released in 3D in theaters all around the world and is the highest grossing concert movie of all time, beating the previous record held by Michael Jackson's This Is It from 2009.",https://www.youtube.com/watch?v=COJCN3Mhr14,"['manager', 'canada', 'pop singer', 'prayer', 'music competition', 'tour bus', 'aftercreditsstinger', 'duringcreditsstinger']",14.135,318,5.1
63710,Honey 2,2011-06-23,"['Comedy', 'Drama', 'Music']",OchVVwxVub4,"After a brush with the law, Maria has returned to her gritty Bronx roots to rebuild her life with nothing but a talent for street dance and a burning ambition to prove herself.",https://www.youtube.com/watch?v=OchVVwxVub4,"['competition', 'dance', 'sequel', 'bronx, new york city', 'dance crew']",18.973,315,6.3
81440,"Good Luck Charlie, It's Christmas!",2011-12-04,"['TV Movie', 'Comedy', 'Family']",XcIEsTubRJw,"Teddy Duncan's middle-class family embarks on a road trip from their home in Denver to visit Mrs. Duncans Parents, the Blankenhoopers, in Palm Springs. When they find themselves stranded between Denver and Utah, they try to hitch a ride to Las Vegas with a seemingly normal older couple in a station wagon from Roswell, New Mexico. It turns out that the couple believes they are the victims of alien abduction. The Duncan's must resort to purchasing a clunker Yugo to get to Utah, have their luggage stolen in Las Vegas, and survive a zany Christmas with Grandpa and Grandma Blankenhooper.",https://www.youtube.com/watch?v=XcIEsTubRJw,"['road trip', 'woman director', 'christmas']",10.653,313,6.5
47760,Restless,2011-09-16,"['Drama', 'Romance']",pzUKbPAynxU,"Two outsiders, both shaped by the circumstances that have brought them together, forge a deep and lasting love.",https://www.youtube.com/watch?v=pzUKbPAynxU,"['sadness', 'funeral', 'romance', 'kamikaze', 'teen movie', 'death of parent']",10.152,313,6.5
57737,Barbie: A Fairy Secret,2011-03-01,"['Animation', 'Family', 'Fantasy']",q_zib0eFQQE,"Get ready for Barbie: A Fairy Secret, an amazing adventure with Barbie where she discovers there are fairies living secretly all around us! When Ken is suddenly whisked away by a group of fairies, Barbie's two fashion stylist friends reveal they are actually fairies and that Ken has been taken to a magical secret fairy world not far away! Barbie and her rival Raquelle take off with the fairy friends on an action-packed journey to bring him back. Along the way they must stick together and learn that the real magic lies not just in the fairy world itself, but in the power of friendship.",https://www.youtube.com/watch?v=q_zib0eFQQE,[],39.003,312,6.5
94363,Hick,2011-09-10,"['Comedy', 'Drama']",xXyUlzTgnrU,A pistol-packing teen meets an unstable rebel and a cocaine-snorting drifter as she hitchhikes her way out West.,https://www.youtube.com/watch?v=xXyUlzTgnrU,"['child abandonment', 'duringcreditsstinger']",10.598,311,5.7
74944,War of the Buttons,2011-09-12,"['Family', 'Adventure']",,1960. The thrilling battles waged by a band of kids from two rival villages in the southern French countryside.,,[],6.853,310,6
68637,Ducoboo,2011-06-22,['Comedy'],,"Ducoboo is a very inventive dunce and joker, he is very resourceful at finding new ways to copy from his neighbor, to cheat or to defy the teacher's authority.",,[],5.874,309,4.9
72478,Suicide Room,2011-03-04,"['Drama', 'Thriller', 'Animation']",,"Dominik is an ordinary boy. He's got loads of friends, the hottest girl in school, rich parents and money to spend on brand-name clothes. But one innocent kiss with a mate changes everything. He begins to isolate himself from the outside world, spending all his time on his computer. He meets an anonymous girl who introduces him to the ""suicide room"", a place from which there is no escape. Caught in a trap woven of his own emotions, Dominik becomes entangled in a web of intrigue and gradually loses what he cherishes most.",,"['suicide', 'isolation', 'virtual reality', 'high school', 'internet', 'teenager', 'teenage boy', 'computer game', 'humiliation', 'mental illness', 'lgbt', 'mental health', 'dare', 'chat room', 'virtual world', 'high school drop out', 'gay']",6.857,309,7.4
70868,I Don't Know How She Does It,2011-09-16,"['Romance', 'Comedy']",bn_OrhwIidA,"A comedy centered on the life of Kate Reddy, a finance executive who is the breadwinner for her husband and two kids.",https://www.youtube.com/watch?v=bn_OrhwIidA,"['pregnancy', 'family vacation', 'widower', 'working mum', 'in-laws']",13.47,299,5.3
278427,Family Guy Presents: It's a Trap!,2011-05-22,"['Animation', 'Fantasy', 'Comedy', 'Science Fiction']",yLldVtS-G04,"With the Griffins stuck again at home during a blackout, Peter tells the story of “Star Wars Episode VI: Return of the Jedi.”",https://www.youtube.com/watch?v=yLldVtS-G04,"['space war', 'sequel', 'sword fight', 'jedi', 'fictional war', 'combat', 'galactic war', 'talking fish', 'disco ball']",11.246,298,6.8
79113,A Princess for Christmas,2011-12-03,"['Comedy', 'Family', 'TV Movie', 'Romance']",UeqkKQv5SiY,"After her sister and brother-in-law's tragic death, an American woman who is the guardian for her young niece and nephew is invited to a royal European castle for Christmas by her late brother-in-law's father, the Duke of Castlebury. Feeling out of place as a commoner, she is determined to give her family a merry Christmas and surprises herself when she falls for a handsome prince.",https://www.youtube.com/watch?v=UeqkKQv5SiY,"['holiday', 'servant', 'butler', 'prince', 'castle', 'royalty', 'ballroom dancing', 'maid', 'christmas']",14.604,298,7
101173,Coriolanus,2011-02-14,"['Drama', 'Thriller']",bsYrGIQnmxo,"Caius Martius, aka Coriolanus, is an arrogant and fearsome general who has built a career on protecting Rome from its enemies. Pushed by his ambitious mother to seek the position of consul, Coriolanus is at odds with the masses and unpopular with certain colleagues. When a riot results in his expulsion from Rome, Coriolanus seeks out his sworn enemy, Tullus Aufidius. Together, the pair vow to destroy the great city.",https://www.youtube.com/watch?v=bsYrGIQnmxo,"['senate', 'general', 'market', 'rivalry', 'tragedy', 'tears', 'scar', 'stabbing', 'truce', 'flag']",10.409,292,5.8
77941,I soliti idioti,2011-11-04,['Comedy'],,,,[],5.082,288,5
76543,Tyrannosaur,2011-10-07,"['Drama', 'Romance']",nvyqXFmV-LI,"The story of Joseph, a man plagued by violence and a rage that is driving him to self-destruction. As Joseph's life spirals into turmoil a chance of redemption appears in the form of Hannah, a Christian charity shop worker. Their relationship develops to reveal that Hannah is hiding a secret of her own with devastating results on both of their lives.",https://www.youtube.com/watch?v=nvyqXFmV-LI,"['pub', 'beating', 'religion', 'domestic violence', 'pitbull', 'urination', 'violence', 'rage', 'prison visit', 'death of husband', 'drunkenness', 'charity shop']",7.037,286,7.3
70586,Setup,2011-10-17,"['Action', 'Crime', 'Drama', 'Thriller']",hSgFGQjyttY,"A group of friends plan out a detailed heist that turns deadly when one betrays the other by taking off with the goods. Taking matters into his own hands, Sonny seeks out his revenge teaming up with the most dangerous mob boss in town to get back what is rightfully his. When he finally comes face to face with his longtime friend he will be forced to make a life changing choice.",https://www.youtube.com/watch?v=hSgFGQjyttY,"['heist', 'betrayal']",10.576,286,4.8
79643,Anche se è amore non si vede,2011-11-23,['Comedy'],,,,[],4.616,283,6.3
77561,EVA,2011-10-06,"['Drama', 'Science Fiction']",RuQBO7lR3io,"In 2041, humans live side-by-side with robots and androids. A well-known cybernetic engineer, Alex Garel, returns to his hometown to create a new model of robot child.",https://www.youtube.com/watch?v=RuQBO7lR3io,"['android', 'robot', 'robotics', 'future earth', 'human android relationship']",9.42,280,6.3
52067,Cedar Rapids,2011-02-11,['Comedy'],d7LkZwnfwfc,A naive Midwesterner insurance salesman travels to a big-city convention in an effort to save the jobs of his co-workers.,https://www.youtube.com/watch?v=d7LkZwnfwfc,"['hotel', 'infidelity', 'iowa', 'one-night stand', 'insurance salesman', 'friendship', 'swimming pool', 'drinking', 'naive', 'duringcreditsstinger']",8.32,280,5.9
56831,The Sunset Limited,2011-02-12,"['Drama', 'TV Movie']",l0MSitTAYyA,"Based on the play of the same name by Pulitzer Prize Winner Cormac McCarthy, this searing two-character drama mixes humor and pathos while examining the relationship between strangers who are brought together by desperate circumstances. Set in a New York tenement apartment, the story focuses on two very different men - a deeply religious black ex-con who thwarts the suicide attempt of an asocial white college professor who tried to throw himself in front of an oncoming subway train, 'The Sunset Limited.' As the one attempts to connect on a rational, spiritual and emotional level, the other remains steadfast in his hard-earned despair. Locked in a philosophical debate, both passionately defend their personal credos and try to convert the other.",https://www.youtube.com/watch?v=l0MSitTAYyA,[],9.433,278,7.2
74879,Once Upon a Time in Anatolia,2011-09-23,"['Drama', 'Crime']",jJOFUsO_N20,"In the rural area around the Anatolian town of Keskin, the local prosecutor, police commissar, and doctor lead a search for a victim of a murder to whom a suspect named Kenan and his mentally challenged brother confessed. However, the search is proving more difficult than expected as Kenan is fuzzy as to the body's exact location. As the group continues looking, its members can't help but chat among themselves about both trivia and their deepest concerns in an investigation that is proving more trying than any of them expected.",https://www.youtube.com/watch?v=jJOFUsO_N20,"['trip', 'buried alive', 'murder', 'dead body', 'doctor', 'policeman', 'anatolia, turkey']",9.696,277,7.6
63831,The Kid with a Bike,2011-05-18,['Drama'],Ce3t1YIYokY,"Abandoned by his father, a young boy is left in the hands of an unqualified childcare provider.",https://www.youtube.com/watch?v=Ce3t1YIYokY,"['redemption', 'orphan', 'bike', 'pardon', 'acceptance']",8.87,277,7.2
76122,Marvel One-Shot: The Consultant,2011-09-13,"['Adventure', 'Fantasy', 'Science Fiction', 'Action']",,"Agent Coulson informs Agent Sitwell that the World Security Council wishes Emil Blonsky to be released from prison to join the Avengers Initiative. As Nick Fury doesn't want to release Blonsky, the two agents decide to send a patsy to sabotage the meeting...",,"['based on comic', 'marvel cinematic universe', 'short']",18.799,272,6.5
67884,Chinese Take-Away,2011-03-24,['Comedy'],,A comedy that chronicles a chance encounter between Robert and a Chinese named Jun who wanders lost through the city of Buenos Aires in search of his uncle after being assaulted by a taxi driver and his henchmen.,,[],6.557,272,7.3
56590,All Star Superman,2011-02-22,"['Animation', 'Action', 'Adventure']",DeWMWGJxSvA,"Lex Luthor enacts his plan to rid the world of Superman, once and for all. Succeeding with solar radiation poisoning, the Man of Steel is slowly dying. With what little times remains, the Last Son of Krypton must confront the revealing of his secret identity to Lois Lane and face Luthor in a final battle.",https://www.youtube.com/watch?v=DeWMWGJxSvA,"['dc comics', 'superhero', 'super power', 'superhuman strength']",13.26,271,6.8
